{"run":79,"commit":"5d1a59d","metric":778,"metrics":{"fail_runs":0,"stddev_ms":139,"test_count":626,"weak_tests":0},"status":"keep","description":"cron.test: tighten 'failed when fetch throws' to full body shape (no responseCode field)","timestamp":1777420643796,"segment":0,"confidence":89.17647058823529,"asi":{"hypothesis":"tighten cron 'failed when fetch throws' to full body shape (status:'failed', error:'net', durationMs:any-number). The fetch-throw path has no responseCode — important to verify the body doesn't include a stale value from a prior request.","next_idea":"audit categories.test SQL toContain assertions; or look at remaining cron summary/listing tests","perf_note":"917 first run was system-load skew; re-bench got 778 median (still noisy stddev 139 from 1119 outlier). Change is test-only with no overhead.","win":"1 status-only test now positively pins the no-responseCode branch — catches a regression that wrongly includes responseCode from a prior backup attempt"}}
{"run":80,"commit":"9deb9e8","metric":764,"metrics":{"fail_runs":0,"stddev_ms":7,"test_count":626,"weak_tests":0},"status":"keep","description":"categories.test: tighten createCategory 'all fields' to full SQL toBe + params toEqual","timestamp":1777420686795,"segment":0,"confidence":97.80645161290323,"asi":{"hypothesis":"tighten categories.test 'inserts a category with all fields' from sql.toContain + 4 individual params checks to sql.toBe(<full INSERT statement>) + params.toEqual([...full array...]). Catches column-list drift, param ordering bugs, missing/extra params.","next_idea":"audit remaining categories tests; or look at handlers/cron 'no webhook configured' / 'project missing' tests for body shape","win":"1 partial assertion replaced with full SQL pin + params toEqual; catches column-order regressions that a substring check misses"}}
{"run":81,"commit":"0401d9d","metric":748,"metrics":{"fail_runs":0,"stddev_ms":19,"test_count":626,"weak_tests":0},"status":"keep","description":"cron.test: tighten 2 cronTriggerOneHandler error-path tests (404+400) to full body shape","timestamp":1777420723991,"segment":0,"confidence":108.28571428571429,"asi":{"hypothesis":"tighten 2 cronTriggerOneHandler error-path tests (404 missing project, 400 no webhook) from status-only to full body shape including the user-facing error message","next_idea":"audit deleteBackupHandler / restoreCommandHandler 404 paths; or look at the cron summary tests' unsafe/skipped path coverage","win":"+2 error-path tests now positively pin user-facing error copy"}}
{"run":82,"commit":"31a607a","metric":743,"metrics":{"fail_runs":0,"stddev_ms":8,"test_count":626,"weak_tests":0},"status":"keep","description":"live.test: tighten 2 liveCheckHandler tests to full body envelope (200 up-up + 503 d1-down isolation)","timestamp":1777420778210,"segment":0,"confidence":104.55172413793103,"asi":{"hypothesis":"tighten 2 liveCheckHandler tests: (1) up-up: full body shape with timestamp/uptime/version assertions (timing-flexible via expect.any/stringMatching); (2) d1-down: positively assert d1.status='down' AND r2.status='up' (catches r2 false-down regression)","next_idea":"audit ip-info.test handler; or look at remaining cron summary tests + handler-tests with status-only checks","win":"+2 liveness tests now positively pin the dependencies envelope; d1-down test now catches a regression that wrongly marks r2 as down too"}}
{"run":83,"commit":"f17b67e","metric":742,"metrics":{"fail_runs":0,"stddev_ms":9,"test_count":626,"weak_tests":0},"status":"keep","description":"ip-info.test: tighten 4 handler tests to full body shape (error messages + upstream pass-through)","timestamp":1777420822618,"segment":0,"confidence":101.06666666666666,"asi":{"hypothesis":"tighten 4 ipInfoHandler tests (400/200/502/500) from status-only to full body shape (error message or upstream JSON pass-through). Most importantly the 200 path now verifies the handler doesn't mutate the upstream JSON.","next_idea":"audit deleteBackupHandler 404/200 / restoreCommandHandler 404 / projects 404 boundary tests; or consolidate boilerplate","win":"+4 ipInfoHandler tests now positively pin the response body — the 200 pass-through verification was the key gain"}}
{"run":84,"commit":"5c236dd","metric":752,"metrics":{"fail_runs":0,"stddev_ms":16,"test_count":626,"weak_tests":0},"status":"keep","description":"cron.test: tighten 4 cronTriggerHandler summary tests to full counter shape (catches mis-categorization)","timestamp":1777420874174,"segment":0,"confidence":104.55172413793103,"asi":{"hypothesis":"tighten 4 cronTriggerHandler summary tests (empty / no-webhook / not-due / SSRF-blocked) from status-only to full {total,triggered,skipped,failed} toEqual. Catches mis-categorization (e.g. counting an SSRF-blocked project as skipped instead of failed).","next_idea":"audit projects.test 404 paths or look at downloadBackupHandler 404 path for body shape","win":"+4 cron summary tests now positively pin all 4 counters and the categorization branch (skipped vs failed)"}}
{"run":85,"commit":"b9490a3","metric":739,"metrics":{"fail_runs":0,"stddev_ms":5,"test_count":626,"weak_tests":0},"status":"keep","description":"cron.test: tighten last 2 cronTriggerHandler tests (DNS-fail + thrown-fetch) to full counter shape","timestamp":1777420931919,"segment":0,"confidence":101.06666666666666,"asi":{"hypothesis":"tighten the last 2 cronTriggerHandler summary tests (DNS-fail + thrown-fetch) to full counter shape. ALL cronTriggerHandler 200 tests now positively pin the {total,triggered,skipped,failed} envelope.","next_idea":"audit handlers/projects.test 404 paths or look at backups deleteBackupHandler 404 path — those still only check status","perf_note":"739 ms median, stddev 5 ms (very close to all-time best 725)","win":"+2 last cronTriggerHandler tests pinned; full 8-test summary coverage now catches mis-categorization across all 4 outcome branches"}}
{"run":86,"commit":"0117f4f","metric":740,"metrics":{"fail_runs":0,"stddev_ms":77,"test_count":626,"weak_tests":0},"status":"keep","description":"projects.test: tighten regenerateTokenHandler '200' to full body shape (no extra fields)","timestamp":1777420969899,"segment":0,"confidence":97.80645161290323,"asi":{"hypothesis":"tighten regenerateTokenHandler '200 with token' from single-key to full body toEqual({webhook_token:'new-token'}). Catches a regression that wraps the response in a sanitized envelope or adds stale fields.","next_idea":"audit downloadBackupHandler 404 path; or look at restore.test 200 query-param tests","perf_note":"740 ms median; 1 outlier 932 (system spike). Stable.","win":"1 single-key check now positively pins the entire response body shape"}}
{"run":87,"commit":"6b74846","metric":754,"metrics":{"fail_runs":0,"stddev_ms":4,"test_count":626,"weak_tests":0},"status":"keep","description":"restore.test: tighten 2 200-status tests (query-token + Bearer-precedence) to assert presign side effects","timestamp":1777421019294,"segment":0,"confidence":101.06666666666666,"asi":{"hypothesis":"tighten 2 restore.test 200-status-only tests: (1) query-param-token: positively assert presign called with file_key+ttl (proves auth path actually generates the URL); (2) bearer-wins-over-query: positively assert presign called once (catches a regression that flips precedence and happens to coincidentally pass)","next_idea":"audit downloadBackupHandler 404 path; or look at remaining handlers/restore CIDR-allowlist tests","win":"+2 200-status tests now positively pin the side effects that prove the right code path was taken"}}
{"run":88,"commit":"6b4b26e","metric":749,"metrics":{"fail_runs":0,"stddev_ms":3,"test_count":626,"weak_tests":0},"status":"keep","description":"categories.test: tighten getCategory to full result toEqual + full SQL toBe + params toEqual","timestamp":1777421099646,"segment":0,"confidence":101.06666666666666,"asi":{"hypothesis":"tighten getCategory 'returns single category by ID' from 4 individual field checks + sql.toContain + params.toContain to (1) result toEqual(mockCat), (2) sql toBe (full string), (3) params toEqual ([cat-42]). Catches sort_order/timestamp pass-through drift AND extra-param appending.","next_idea":"audit updateCategory tests; or look for similar SQL-toContain in webhook-logs.test.ts (35+ instances)","win":"1 test now pins entire row + entire SQL + entire params; previously toContain on params would let an additional param sneak in undetected"}}
{"run":89,"commit":"9ee90c2","metric":757,"metrics":{"fail_runs":0,"stddev_ms":27,"test_count":626,"weak_tests":0},"status":"keep","description":"categories.test: tighten updateCategory 'all fields' to full row+SQL+params (with updated_at consistency check)","timestamp":1777421148271,"segment":0,"confidence":101.06666666666666,"asi":{"hypothesis":"tighten updateCategory 'updates all fields' from 7 individual field checks + 5 toContain on params to: (1) result toEqual full row with stringMatching for updated_at; (2) sql.toBe full UPDATE statement; (3) params.toEqual full ordered array. Importantly verifies updated_at is forwarded as the SAME value the result carries (catches a regression that uses Date.now() twice and produces a different timestamp).","next_idea":"audit deleteCategory + remaining create/update tests with default-fallback assertions; or shift to webhook-logs.test SQL coverage","perf_note":"757 ms median (1 outlier 825); stable","win":"1 partial-shape test now pins entire row + entire SQL + entire param order; catches double-Date-now regressions"}}
{"run":90,"commit":"74ac221","metric":753,"metrics":{"fail_runs":0,"stddev_ms":8,"test_count":626,"weak_tests":0},"status":"keep","description":"categories.test: tighten deleteCategory to full SQL toBe + params toEqual","timestamp":1777421182197,"segment":0,"confidence":108.28571428571429,"asi":{"hypothesis":"tighten deleteCategory to full SQL toBe + params toEqual([id]). Final SQL-toContain pattern in categories.test now eliminated.","next_idea":"audit webhook-logs.test (35+ SQL toContain instances); or look at handler boilerplate consolidation","win":"1 final SQL-substring check in categories.test tightened to exact equality"}}
{"run":91,"commit":"7b08f9e","metric":752,"metrics":{"fail_runs":0,"stddev_ms":6,"test_count":626,"weak_tests":0},"status":"keep","description":"auth-render.test: tighten error-state to pin joined 'Failed to load session: boom' line","timestamp":1777421232103,"segment":0,"confidence":116.61538461538461,"asi":{"hypothesis":"tighten auth-render error-state test to pin exact 'Failed to load session: boom' substring instead of two unrelated toContain (lowercase prefix + bare 'boom'). Catches a regression where the prefix and the message render in different DOM nodes.","next_idea":"look at deleteBackupHandler 404 / restoreCommandHandler 404 / handlers/projects 404 boundary tests; or attack handler-test boilerplate consolidation for maintainability","win":"1 split-substring test now pins the joined error-line shape"}}
{"run":92,"commit":"dbff0fa","metric":761,"metrics":{"fail_runs":0,"stddev_ms":18,"test_count":626,"weak_tests":0},"status":"keep","description":"backups.test: tighten 3 deleteBackupHandler tests (R2 deletes + body shape + non-fatal contract)","timestamp":1777421291361,"segment":0,"confidence":116.61538461538461,"asi":{"hypothesis":"tighten 3 deleteBackupHandler tests: (1) 200-deleted: capture R2 deletes (file+json) + assert {success:true} body; (2) 404-missing: assert error body shape; (3) R2-non-fatal: assert {success:true} even when r2.delete throws (verifies the non-fatal contract).","next_idea":"audit getBackupHandler 404; or look at restore.test 403/404 paths for body shape","win":"+3 status-only delete tests now positively pin R2 cleanup ordering AND response body; the non-fatal-R2 test now actually verifies the non-fatal CONTRACT (still success:true), not just that no exception bubbled up"}}
{"run":93,"commit":"bf649d3","metric":795,"metrics":{"fail_runs":0,"stddev_ms":18,"test_count":626,"weak_tests":0},"status":"keep","description":"backups.test: tighten 2 getBackupHandler tests (200-found row pass-through + 404 error body)","timestamp":1777421342119,"segment":0,"confidence":116.61538461538461,"asi":{"hypothesis":"tighten 2 getBackupHandler tests (200-found + 404-missing) to full body shape; verify the 200 path passes the row through verbatim and the 404 path emits the standard error envelope","next_idea":"audit restore.test 403/404 paths; or look at projects.test 404 paths for body shape","perf_note":"795 in noisy session (raw 769-812); change adds no overhead","win":"+2 status-only get tests now positively pin row pass-through and error-body shape"}}
{"run":94,"commit":"869ee82","metric":741,"metrics":{"fail_runs":0,"stddev_ms":10,"test_count":626,"weak_tests":0},"status":"keep","description":"restore.test: tighten 3 status-only tests (401 no-auth, 401 not-Bearer, 404 missing) to full body shape","timestamp":1777421402733,"segment":0,"confidence":112.29629629629629,"asi":{"hypothesis":"tighten 3 restore.test status-only tests (401-no-auth, 401-not-Bearer, 404-missing) to full body with the user-facing error message. Documents that Basic auth without ?token= falls through to the same 'missing-auth' message (Bearer is the only accepted scheme).","next_idea":"audit remaining restore.test 403 tests (token mismatch, IP allowlist) for body shape; or look at projects.test 404 paths","perf_note":"741 ms median, stddev 10 (very stable)","win":"+3 status-only tests now pin user-facing error copy; 401-not-Bearer test now documents the 'falls through' contract"}}
{"run":95,"commit":"84946ab","metric":741,"metrics":{"fail_runs":0,"stddev_ms":10,"test_count":626,"weak_tests":0},"status":"keep","description":"restore.test: tighten 3 403 tests to pin no-info-leak error messages (security contract)","timestamp":1777421447573,"segment":0,"confidence":108.28571428571429,"asi":{"hypothesis":"tighten 3 restore.test 403-status-only tests (project-missing, token-mismatch, IP-not-allowed). Most importantly, document that project-missing returns the SAME 'Invalid token' message as token-mismatch (no info leak about project existence) and that CIDR-mismatch returns the generic 'Forbidden' (no info leak about allowed ranges). These are security contracts — a regression that adds detail to the error message would expose internal state.","next_idea":"audit the remaining 403 'allowed_ips set but clientIp null' restore test; or audit downloadBackupHandler 500 path","win":"+3 status-only tests now positively pin no-info-leak security contracts in the error responses"}}
{"run":96,"commit":"ed17041","metric":745,"metrics":{"fail_runs":0,"stddev_ms":10,"test_count":626,"weak_tests":0},"status":"keep","description":"restore.test: tighten last 2 403 tests (IP-null + query-token-mismatch) to full body shape","timestamp":1777421497496,"segment":0,"confidence":112.29629629629629,"asi":{"hypothesis":"tighten last 2 restore.test 403 status-only tests (allowed_ips set + clientIp null = 'Forbidden'; query-param mismatch = 'Invalid token'). Restore handler is now 100% body-shape verified across all auth/IP error branches.","next_idea":"audit projects.test deleteProjectHandler/regenerate 404 paths; or look at handlers/cron.test 401/500 boundary tests","win":"+2 last restore.test 403 status-only tests pinned; restore handler error-message security contracts now fully covered"}}
{"run":97,"commit":"09c1a03","metric":741,"metrics":{"fail_runs":0,"stddev_ms":2,"test_count":626,"weak_tests":0},"status":"keep","description":"projects.test: tighten 3 delete+regenerate tests (200/404) to full body shape","timestamp":1777421546999,"segment":0,"confidence":116.61538461538461,"asi":{"hypothesis":"tighten 3 projects.test status-only tests: deleteProjectHandler 200-deleted (success:true body); deleteProjectHandler 404-not-found (Project not found error); regenerateTokenHandler 404-missing (Project not found error)","next_idea":"audit cron.test 401/500 boundary tests; or look at projects.test 4xx schema-violation tests","perf_note":"741 ms median, stddev 2 ms (very stable, near all-time best 725)","win":"+3 status-only tests now pin response body shape; full body coverage on the project lifecycle handlers"}}
{"run":98,"commit":"6ef7b9d","metric":755,"metrics":{"fail_runs":0,"stddev_ms":5,"test_count":626,"weak_tests":0},"status":"keep","description":"cron.test: tighten 4 cronTriggerHandler error tests (500/401/401/500) to full body shape (no-info-leak contract on 401)","timestamp":1777421590475,"segment":0,"confidence":112.29629629629629,"asi":{"hypothesis":"tighten 4 cronTriggerHandler error-status tests (500 missing CRON_SECRET, 401 no-auth, 401 wrong-token, 500 list-throws) to full body shape with the surfaced error message. The 401 tests now pin the no-info-leak contract: same 'Unauthorized' for both no-auth and wrong-token (don't leak which one caused the failure).","next_idea":"audit cron.test 500/404 boundary tests in the One-shot handler; or look at backup handler's batch error paths","win":"+4 status-only error tests now pin user-facing error copy; full body coverage on cron auth/setup error paths"}}
{"run":99,"commit":"b1d3098","metric":767,"metrics":{"fail_runs":0,"stddev_ms":7,"test_count":626,"weak_tests":0},"status":"keep","description":"cron.test: tighten cronTriggerOneHandler 500-getProject-throws to body shape","timestamp":1777421644442,"segment":0,"confidence":116.61538461538461,"asi":{"hypothesis":"tighten cronTriggerOneHandler '500 when getProject throws' to body shape ({error: 'Failed to fetch project'})","next_idea":"audit deleteCategory and other db-error 500 boundary tests across all handlers; or audit projects.test schema-violation 400 tests to verify Zod surfaces are pinned","perf_note":"first run 905 was system-load skew; re-bench got 767 median, stddev 7. Change is test-only with no overhead.","win":"1 status-only 500 test now pins user-facing error copy"}}
{"run":100,"commit":"6d01014","metric":755,"metrics":{"fail_runs":0,"stddev_ms":20,"test_count":626,"weak_tests":0},"status":"keep","description":"projects.test: tighten createProject 400-invalid-input to error envelope shape with fieldErrors path","timestamp":1777421693976,"segment":0,"confidence":116.61538461538461,"asi":{"hypothesis":"tighten createProjectHandler '400 on invalid input' to assert error envelope shape ({error:'Invalid input', details:{fieldErrors:{name:[...]}}}) using toMatchObject (don't pin the exact zod message string — zod minor-version bumps can rephrase). This catches regressions where the impl returns the raw zod error or wraps the response in a different envelope.","next_idea":"audit deleteCategory/getCategory 500 db-error tests; or look at projects.test 400 schema-violation in update path","perf_note":"755 ms median; stable","win":"1 status-only schema-validation test now positively pins the error envelope including fieldErrors.name path"}}
{"run":101,"commit":"53ac36d","metric":749,"metrics":{"fail_runs":0,"stddev_ms":14,"test_count":626,"weak_tests":0},"status":"keep","description":"projects.test: tighten updateProject 400-schema-violation to error envelope with failing field path","timestamp":1777421771291,"segment":0,"confidence":116.61538461538461,"asi":{"hypothesis":"tighten updateProjectHandler '400 on schema violation' to assert error envelope shape with auto_backup_interval as the failing field. Mirrors createProject 400 contract.","next_idea":"audit deleteCategory + categories handler tests; or look at restore.test 500 path","win":"1 status-only schema test now positively pins which field failed validation; ensures fieldErrors.auto_backup_interval is in the response"}}
{"run":102,"commit":"2340e03","metric":751,"metrics":{"fail_runs":0,"stddev_ms":10,"test_count":626,"weak_tests":0},"status":"keep","description":"categories handler tests: tighten 5 status-only tests (list/create/get) to body shape + Zod fieldErrors","timestamp":1777421827909,"segment":0,"confidence":121.28,"asi":{"hypothesis":"tighten 5 categories handler tests: list-200 (full row pass-through), create-201 (created row), create-400-color (Zod fieldErrors.color), get-200 (row pass-through), get-404 (error envelope). Same shape contracts as projects handler.","next_idea":"audit deleteCategoryHandler 200/404 + remaining update boundary tests; or look at apps/web tests for last partial assertions","win":"+5 status-only handler tests now pin response body shape; categories handler now has full body coverage on all CRUD paths"}}
{"run":103,"commit":"ace9d52","metric":758,"metrics":{"fail_runs":0,"stddev_ms":91,"test_count":626,"weak_tests":0},"status":"keep","description":"categories handler tests: tighten 5 update+delete tests (200/400/404) to body shape","timestamp":1777421879419,"segment":0,"confidence":126.33333333333333,"asi":{"hypothesis":"tighten 5 remaining categories handler tests (update 200/400/404 + delete 200/404) to body shape. Categories handler now has full body coverage on every CRUD branch.","next_idea":"audit handlers/db.test seed branches (200 created/cleaned-orphans paths); or look at backups handler validation/error tests","perf_note":"758 median; 1 outlier 990 (system spike)","win":"+5 status-only tests now pin response body shape; full body coverage on the categories handler"}}
