{"type":"config","name":"UT 质量优化（保覆盖率，提升意义/性能/稳定性）","metricName":"total_ms","metricUnit":"ms","bestDirection":"lower"}
{"run":1,"commit":"8a907c4","metric":2241,"metrics":{"stddev_ms":258,"weak_tests":3,"test_count":648,"fail_runs":0},"status":"keep","description":"baseline: 4 workspaces (web 12/75 + api 26/488 + worker 5/80 + cli 1/5 = 44 files / 648 cases)","timestamp":1777414730407,"segment":0,"confidence":null,"asi":{"hypothesis":"establish baseline","raw_times_ms":[2172,2861,2241,2296,2186],"test_count_via_runexp_is_0":"awk works in standalone bash but reports 0 via run_experiment harness; harmless secondary metric; investigate later","noise_floor_observation":"stddev 258 indicates first run is consistently slowest (jit warmup); future runs may want to discard first sample"}}
{"run":2,"commit":"12c1b6f","metric":1234,"metrics":{"fail_runs":0,"stddev_ms":12,"test_count":648,"weak_tests":3},"status":"keep","description":"parallelize workspace test runs (& wait)","timestamp":1777414776479,"segment":0,"confidence":null,"asi":{"hypothesis":"run 4 workspaces in parallel with & wait","result":"huge win: 2241→1234 ms (-45%) and stddev 258→12 (much more stable; first-run JIT cost is now masked by the slower workspace)","test_count_verified_locally":648,"next_idea":"merge web+api+worker+cli into a single vitest project (workspaces) to share transform/import; or tune pool/threads; explore happy-dom replacement for jsdom-lite to cut web import time"}}
{"run":3,"commit":"e3ec5a3","metric":1140,"metrics":{"fail_runs":0,"stddev_ms":54,"test_count":648,"weak_tests":3},"status":"keep","description":"web: pool=threads singleThread, isolate:false","timestamp":1777414829760,"segment":0,"confidence":11.712765957446809,"asi":{"hypothesis":"web vitest pool=threads singleThread isolate:false to skip per-file env init","next_idea":"apply same singleThread+isolate:false to api & worker (they're node env, even cheaper); also try vitest projects merge"}}
{"run":4,"commit":"fb2fee8","metric":1109,"metrics":{"fail_runs":0,"stddev_ms":68,"test_count":648,"weak_tests":3},"status":"keep","description":"api+worker: pool=threads singleThread, isolate:false; benchmark: add warmup run","timestamp":1777414916379,"segment":0,"confidence":18.112,"asi":{"hypothesis":"api+worker also pool=threads singleThread isolate:false; benchmark adds untimed warmup","next_idea":"the bottleneck is now likely web (happy-dom env init); consider switching some web tests off happy-dom; or merge into vitest projects single process"}}
{"run":5,"commit":"867fe72","metric":900,"metrics":{"fail_runs":0,"stddev_ms":28,"test_count":648,"weak_tests":3},"status":"keep","description":"vitest 4 migration: maxWorkers:1, isolate:false (top-level)","timestamp":1777414999022,"segment":0,"confidence":14.26595744680851,"asi":{"hypothesis":"v4 migration: poolOptions removed; use top-level maxWorkers:1 + isolate:false","interesting_finding":"scaffold.test.ts > App module is importable takes 302ms; many web tests are trivial 'X is a function' surface checks that add no behavioral coverage but my weak-tests scanner misses them (they use toBe('function') not toBeDefined). Improve scanner heuristic next.","next_idea":"improve weak-tests heuristic to flag toBe('function')/toBe('object') existence checks; consider deleting the most expensive trivial tests if coverage thresholds still hold"}}
{"run":6,"commit":"7a8ba29","metric":857,"metrics":{"fail_runs":0,"stddev_ms":10,"test_count":647,"weak_tests":23},"status":"keep","description":"delete trivial scaffold.test.ts (302ms surface-only test)","timestamp":1777415069828,"segment":0,"confidence":8.2874251497006,"asi":{"hypothesis":"delete scaffold.test.ts (302ms single trivial 'App is a function' import-smoke test); coverage gates are scoped to src/lib/** so this doesn't break the gate","next_idea":"remove/upgrade other web 'X is a function component' surface tests; many are duplicates of behavior covered elsewhere; consider doing a sweep of layout/projects/backups/logs surface assertions","weak_tests_metric_jumped":"scanner heuristic improved (now catches typeof X === 'function'); 24 → 23 after deletion"}}
{"run":7,"commit":"$(git r","metric":856,"metrics":{"fail_runs":0,"stddev_ms":10,"test_count":647,"weak_tests":23},"status":"keep","description":"url.test: stub node:dns to remove real DNS calls (stability)","timestamp":1777415151690,"segment":0,"confidence":6.626794258373206,"asi":{"hypothesis":"stub node:dns/promises in url.test.ts to remove real DNS calls (~100ms cumulative + flake risk on offline runs)","primary_metric_change":"857→856 within noise; kept primarily for stability/quality (removes real-network dependency, flake-resistant) which fits the explicit user goal","next_idea":"audit other tests doing real I/O; look at handlers/* tests for fetch mocking gaps; or attack web's surface tests to upgrade them into real assertions"}}
{"run":8,"commit":"$(git r","metric":865,"metrics":{"fail_runs":0,"stddev_ms":81,"test_count":646,"weak_tests":23},"status":"discard","description":"remove activity/cron-chart surface imports from charts.test.ts","timestamp":1777415291044,"segment":0,"confidence":9.651567944250871,"asi":{"hypothesis":"drop activity-chart/cron-chart surface imports in charts.test.ts to skip recharts module load","rollback_reason":"no perf delta (855→865 within noise) and no weak_tests reduction (replaced one trivial test with another); recharts probably already cached by another file","next_action_hint":"find which test file actually imports recharts components transitively; or look at api workspace for slow tests; or attack lib-coverage.test.ts (12ms DOM mount)"}}
{"run":9,"commit":"$(git r","metric":857,"metrics":{"fail_runs":0,"stddev_ms":5,"test_count":647,"weak_tests":23},"status":"discard","description":"web: drop plugin-react in vitest config","timestamp":1777415386673,"segment":0,"confidence":31.477272727272727,"asi":{"hypothesis":"drop @vitejs/plugin-react in test config; rely on esbuild's JSX transform via tsconfig jsx:react-jsx","next_action_hint":"web's wall is bounded by ~750ms; the parallel-max bottleneck. Try: split web into two parallel workspaces (DOM vs node), or stop fighting web and look at micro-stability/quality wins","rollback_reason":"no measurable perf delta (856→857); web internal duration unchanged at 563ms; plugin-react babel cost was already negligible","side_finding":"vitest reports same transform time — plugin-react was not actually expensive here"}}
{"run":10,"commit":"$(git r","metric":814,"metrics":{"fail_runs":0,"stddev_ms":10,"test_count":640,"weak_tests":16},"status":"checks_failed","description":"trim projects.test.ts surface tests + heavy imports (broke auth-render via state pollution)","timestamp":1777415452827,"segment":0,"confidence":29.157894736842106,"asi":{"hypothesis":"delete 7 trivial 'X is a function component' surface tests + heavy imports in projects.test.ts","important_finding":"STABILITY BUG: with isolate:false the auth-render test 'renders the loading shim while session is undetermined' depends on global SWR/useMe cache state set up by *another* test file's imports. Removing projects.test.ts's RequireAuth/useMe transitive imports changes module-init order and breaks auth-render. This is a real fragility in the existing tests.","next_idea":"either (a) fix auth-render.test.ts to clear SWR cache in beforeEach so tests are independent, then re-do the projects.test.ts cleanup; or (b) add a vi.mock for useMe in auth-render so it controls state directly instead of depending on global cache state","rollback_reason":"checks failed: auth-render.test.ts > loading-shim test broke due to test pollution"}}
{"run":11,"commit":"bd5945d","metric":817,"metrics":{"fail_runs":0,"stddev_ms":14,"test_count":640,"weak_tests":16},"status":"keep","description":"deterministic auth-render loading test + simplify projects.test.ts (drop 7 surface tests)","timestamp":1777415536266,"segment":0,"confidence":29.666666666666668,"asi":{"hypothesis":"deterministic auth-render loading-shim test (vi.doMock useMe) + delete 7 surface tests + heavy page imports in projects.test.ts","next_idea":"extend the same deletion to layout/backups/logs/dashboard/charts surface tests (now safe since auth-render no longer relies on global useMe state)","win":"856→817 (-39ms / -4.6%) AND 7 weak tests removed (23→16) AND auth-render no longer fragile under module-init reordering"}}
{"run":12,"commit":"ee7d1d1","metric":802,"metrics":{"fail_runs":0,"stddev_ms":13,"test_count":637,"weak_tests":13},"status":"keep","description":"trim layout.test.ts surface tests + heavy radix imports","timestamp":1777415567830,"segment":0,"confidence":31.626373626373628,"asi":{"hypothesis":"trim layout.test.ts: drop AppShell/Sidebar/Breadcrumbs/ThemeToggle/LoadingScreen/SidebarProvider/useSidebar/useIsMobile surface tests + their imports","next_idea":"continue with backups.test.ts (3 surface), logs.test.ts (2), dashboard.test.ts (1), charts.test.ts (recharts). Then look at api workspace handler tests.","win":"817→802 (-15ms) and 16→13 weak tests"}}
{"run":13,"commit":"89fd9ba","metric":750,"metrics":{"fail_runs":0,"stddev_ms":2,"test_count":627,"weak_tests":5},"status":"keep","description":"sweep surface tests + heavy page imports across backups/logs/dashboard/auth; harden TZ-stable assertions","timestamp":1777415687581,"segment":0,"confidence":34.674418604651166,"asi":{"hypothesis":"sweep all remaining web surface tests + heavy page imports (backups/logs/dashboard/auth) and harden assertions to be locale/TZ-stable","next_idea":"go after charts.test.ts (still imports activity-chart/cron-chart for surface assertion); look at lib-coverage.test.ts (uses @testing-library/react for one DOM test — maybe inline as RSC); audit api/handlers boilerplate","side_finding":"formatDate intentionally omits year; my first attempt asserted /2026/ which broke under en-US locale that uses 'Apr 24, 06:00 PM'; replaced with locale-stable shape regex","win":"802→750 (-52ms / -6.5%) and 13→5 weak tests; stddev 2ms (excellent stability)"}}
{"run":14,"commit":"d5d999f","metric":744,"metrics":{"fail_runs":0,"stddev_ms":7,"test_count":626,"weak_tests":4},"status":"keep","description":"charts.test.ts: remove recharts surface assertions; tighten getChartColor negative test","timestamp":1777415734610,"segment":0,"confidence":30.551020408163264,"asi":{"hypothesis":"remove charts.test.ts surface assertions for activity-chart/cron-chart/Backups/StorageByProjectChart and harden getChartColor negative-index test (asserts the actual hsl(var(--chart-N)) shape, not 'is a string')","next_idea":"tackle webhook-logs (2 weak) and routes.test.ts (1 weak) tests; or look at api/handlers boilerplate; or attack lib-coverage's @testing-library/react usage","win":"750→744 and 5→4 weak tests"}}
{"run":15,"commit":"4abeaf1","metric":762,"metrics":{"fail_runs":0,"stddev_ms":64,"test_count":626,"weak_tests":2},"status":"keep","description":"webhook-logs: assert exact error logged + non-throwing resolution (replace weak toHaveBeenCalled())","timestamp":1777415795900,"segment":0,"confidence":27.21818181818182,"asi":{"hypothesis":"harden webhook-logs fire-and-forget tests: assert resolved (not throwing) AND assert exact error message logged, instead of just toHaveBeenCalled()","next_idea":"audit ui.test.ts and routes.test.ts (last 2 weak tests); then attack lib-coverage.test.ts which uses @testing-library/react for one DOM mount","perf_note":"first run was 974ms (bg noise); rerun median 762ms within noise of 744ms baseline; kept primarily for the meaningfulness improvement"}}
{"run":16,"commit":"af32b14","metric":730,"metrics":{"fail_runs":0,"stddev_ms":7,"test_count":625,"weak_tests":1},"status":"keep","description":"delete ui.test.ts radix-ui surface smoke (was slowest single web test, 159ms)","timestamp":1777415828981,"segment":0,"confidence":20.28187919463087,"asi":{"hypothesis":"delete ui.test.ts 'ui primitives importable' surface test (was the slowest single web test at 159ms with 6 heavy radix-ui dynamic imports for zero behavioral coverage)","next_idea":"investigate routes.test.ts last weak (1) and lib-coverage.test.ts DOM mount; or look for redundant tests in api/handlers","win":"744→730 (median tightened) and 4→1 weak tests"}}
{"run":17,"commit":"cbe6636","metric":730,"metrics":{"fail_runs":0,"stddev_ms":9,"test_count":625,"weak_tests":0},"status":"keep","description":"routes.test: explicit assertion on cron-success path; weak_tests \\u2192 0","timestamp":1777415900855,"segment":0,"confidence":16.074468085106382,"asi":{"hypothesis":"make the implicit 'didn't throw' assertion in cron-secret-success test explicit via await expect(...).resolves.toBeUndefined()","next_idea":"weak_tests is now 0 by my heuristic; broader meaningfulness work: dedupe handler-test boilerplate; tighten lib-coverage DOM mount; or bake 'no Date.now in assertions' style rule. Or pivot to perf-only finishing moves: parallelism within api workspace via splitting; idle worker pool; vite cache; etc.","win":"weak_tests 1→0; test runtime stable at 730ms"}}
{"run":18,"commit":"$(git r","metric":751,"metrics":{"fail_runs":0,"stddev_ms":80,"test_count":625,"weak_tests":0},"status":"discard","description":"api: maxWorkers:4 (intra-workspace parallelism)","timestamp":1777415930440,"segment":0,"confidence":18.8875,"asi":{"hypothesis":"api maxWorkers:4 with isolate:false to parallelize the 26 api test files","rollback_reason":"751 vs 730: 4 worker threads contended with the parallel web vitest process for CPU; isolate:false also lost its module-cache benefit when split across workers","next_action_hint":"the 4 workspaces already saturate macbook cores; try reducing web's import budget instead via splitting auth-render's React import into a satellite test file"}}
{"run":19,"commit":"$(git r","metric":731,"metrics":{"fail_runs":0,"stddev_ms":8,"test_count":625,"weak_tests":0},"status":"discard","description":"root test script: bunx vitest direct (skip bun run dispatch)","timestamp":1777416008805,"segment":0,"confidence":22.55223880597015,"asi":{"hypothesis":"skip the `bun --cwd ... run test` indirection and call bunx vitest directly","next_action_hint":"the parallel-max bottleneck is web's cold path (~700ms wall, ~430ms internal). Cold spend = vitest CLI bootstrap + happy-dom init + 12-file import graph. None of these are easy to chip away without prod-code changes.","rollback_reason":"no measurable delta; bun run dispatch overhead is already negligible"}}
{"run":20,"commit":"512c255","metric":727,"metrics":{"fail_runs":0,"stddev_ms":3,"test_count":625,"weak_tests":0},"status":"keep","description":"api: hoist node:dns mock to setupFiles (fixes isolate:false module-cache race that left real DNS in the cache)","timestamp":1777416098849,"segment":0,"confidence":22.1021897810219,"asi":{"hypothesis":"promote node:dns mock from per-file vi.mock (which loses to module-cache races under isolate:false) to a global setupFiles hook — fixes ~100ms of api-workspace runtime that previously fell through to real DNS, plus removes flake risk","next_idea":"audit other lib/url imports in handlers tests; consider similar setup-file extraction for other shared mocks (fetch, console.error noise); look at lib-coverage DOM mount removal","win":"730→727 wall (api workspace internally now 280→180ms thanks to no real DNS); stddev tightened to 3ms"}}
{"run":21,"commit":"$(git r","metric":816,"metrics":{"fail_runs":0,"stddev_ms":142,"test_count":625,"weak_tests":0},"status":"discard","description":"web: default env=node, opt-in happy-dom for lib-coverage only","timestamp":1777416147625,"segment":0,"confidence":22.939393939393938,"asi":{"hypothesis":"switch web default env to node + opt-in happy-dom for lib-coverage.test.ts only (only file using @testing-library/react)","next_action_hint":"stay on a single env per workspace; the worker churn from mixed envs costs more than the env-init savings","rollback_reason":"584ms web (vs 431) because vitest spawns a separate worker for the happy-dom file even with maxWorkers:1; net total 727→816 ms regression"}}
{"run":22,"commit":"629ff1f","metric":755,"metrics":{"fail_runs":0,"stddev_ms":11,"test_count":626,"weak_tests":0},"status":"keep","description":"routes.test: replace flaky ip-info smoke (real .example DNS) with deterministic 503/400 assertions","timestamp":1777416283720,"segment":0,"confidence":23.472868217054263,"asi":{"hypothesis":"rewrite the ip-info routing test: instead of pointing at echo.example (real DNS lookup, 14ms + flake) and asserting [200,500,502], unset ECHO_API_URL and assert the deterministic 503 'not configured' branch; add a 400 missing-ip test for free","next_idea":"audit other [200, 500]-style loose assertions in routes.test.ts; many smoke tests there use OR-of-statuses to hide network/D1 dependencies","perf_note":"first run was 918ms (concurrent system load — vitest CLI start can drift under contention). Re-run median 755 ms within noise of 727. Net trade: ≈25-30ms slower median, +1 test count, removes a real DNS dependency, weak → deterministic assertions."}}
{"run":23,"commit":"d42bc10","metric":762,"metrics":{"fail_runs":0,"stddev_ms":5,"test_count":626,"weak_tests":0},"status":"keep","description":"routes.test: deterministic stats/totals + stats/charts assertions (was [200,500] OR)","timestamp":1777416349125,"segment":0,"confidence":24.03174603174603,"asi":{"hypothesis":"tighten /api/stats/totals + /api/stats/charts smoke tests: assert deterministic 200 with the empty-fallback body shape, instead of OR-of-statuses [200,500] which previously masked any 500 regression in the stats handlers","next_idea":"5 more [200,500]/[200,503]-style loose assertions remain in routes.test.ts (live, db/init, db/seed-test-project, db/init/marker, ...). Each one is a deterministic-ize candidate.","win":"two tests upgraded from weak/non-deterministic to fully shape-asserting; perf within noise (755→762 ms)"}}
{"run":24,"commit":"4acfd9e","metric":753,"metrics":{"fail_runs":0,"stddev_ms":10,"test_count":626,"weak_tests":0},"status":"keep","description":"routes.test: deterministic /api/live (200 + dependencies.{d1,r2}.up)","timestamp":1777416396837,"segment":0,"confidence":26.56140350877193,"asi":{"hypothesis":"tighten /api/live smoke from [200,503] to deterministic 200 + verify ok/up/up branch and body shape","next_idea":"address db/init, db/seed-test-project, cron/trigger/:projectId remaining loose assertions; or look at apps/web's auth-render to extract its mock-useMe pattern into a per-test factory","win":"perf within noise; one more route test made deterministic + adds shape verification"}}
{"run":25,"commit":"3fb97fe","metric":771,"metrics":{"fail_runs":0,"stddev_ms":14,"test_count":626,"weak_tests":0},"status":"keep","description":"routes.test: deterministic db/init + db/seed-test-project (was [200,500] OR)","timestamp":1777416449533,"segment":0,"confidence":27.527272727272727,"asi":{"hypothesis":"tighten /api/db/init + /api/db/seed-test-project from [200,500] OR to deterministic 200 + body.ok/message verification","next_idea":"look at remaining loose assertions in routes.test.ts (cron/trigger/:id 404, DELETE /api/logs); audit api/handlers tests for similar OR-of-statuses patterns","win":"perf within noise (753→771); two more route tests are now meaningful (catch 500 regressions instead of allowing them through)"}}
{"run":26,"commit":"f0222e9","metric":727,"metrics":{"fail_runs":0,"stddev_ms":8,"test_count":626,"weak_tests":0},"status":"keep","description":"routes.test: deterministic cron/trigger/:id 404 + DELETE /api/logs/{webhook,cron}","timestamp":1777416504409,"segment":0,"confidence":27.035714285714285,"asi":{"hypothesis":"tighten cron/trigger/:id 404 + DELETE /api/logs/webhook + /api/logs/cron from OR-of-statuses to deterministic 404/200/204","next_idea":"remaining loose assertions are genuinely 401/404 either-or (auth precedence, will need targeted env setup); diminishing returns. Consider stopping here or pivoting to api/handlers consolidation.","win":"771→727 ms (median tightened by removing the spurious extra runtime that crept in from the prior keeps; 3 more route tests are now meaningful)"}}
{"run":27,"commit":"0d21bb6","metric":729,"metrics":{"fail_runs":0,"stddev_ms":15,"test_count":626,"weak_tests":0},"status":"keep","description":"routes.test: tighten 7 more OR-of-statuses to deterministic 401/404/400","timestamp":1777416592978,"segment":0,"confidence":35.2093023255814,"asi":{"hypothesis":"tighten 7 more OR-of-statuses smoke tests in routes.test.ts: PUT /projects/:id, PUT /categories/:id, GET extract, POST upload, DELETE backups, HEAD/GET webhook — each verified to be deterministic against fakeD1+fakeR2 via standalone bun -e probing first","next_idea":"1 last loose assertion at line 335 (POST webhook with bad token — 401 vs 404 race); attack handler-test boilerplate for maintainability; or look at api/handlers/webhook.test (584 lines) for redundancy","win":"perf within noise (727→729); 7 more route tests catch 500 regressions instead of allowing them through. routes.test.ts now has ~3 genuine OR assertions left (auth-precedence cases)."}}
{"run":28,"commit":"b95e410","metric":735,"metrics":{"fail_runs":0,"stddev_ms":9,"test_count":626,"weak_tests":0},"status":"keep","description":"routes.test: tighten last 2 webhook auth-precedence OR assertions to 401","timestamp":1777416639374,"segment":0,"confidence":39.324675324675326,"asi":{"hypothesis":"tighten last 2 OR-of-statuses (POST /api/webhook/missing with bad token, x-forwarded-for variant) to deterministic 401","next_idea":"no remaining loose-status assertions in any of the 4 workspaces. Focus shifts to handler-test consolidation or further perf via vitest internals (vite cache, fewer transforms).","win":"0 OR-of-statuses left in the suite; all route tests now catch 500 regressions"}}
