{"run":149,"commit":"7a4e49d","metric":747,"metrics":{"fail_runs":0,"stddev_ms":9,"test_count":627,"weak_tests":0},"status":"keep","description":"routes.test: tighten 5 webhook+ctx-env tests (HEAD empty-body + 401/404 body shapes)","timestamp":1777424622260,"segment":0,"confidence":151.6,"asi":{"hypothesis":"tighten 5 routes.test webhook 401 + ctx-env 404 tests: HEAD-401 (text='' contract — HEAD never has body), GET-401 (Missing-Authorization JSON), POST-401 (Missing-Authorization JSON), HEAD-x-fwd-for-401 (text=''), ctx-env-prompt-404 (Project-not-found pinned). Documents the body-vs-empty contract per HTTP method.","next_idea":"audit remaining lib coverage tests; or look at handler-response.test","perf_note":"747 ms median, stddev 9 (very stable, near all-time best 725)","win":"+5 status-only tests now pin response body shape AND HEAD-empty-body contract"}}
{"run":150,"commit":"7fdd86b","metric":752,"metrics":{"fail_runs":0,"stddev_ms":12,"test_count":627,"weak_tests":0},"status":"keep","description":"routes.test: tighten D1-propagate test to assert sanitizeProject integration contract","timestamp":1777424663281,"segment":0,"confidence":151.6,"asi":{"hypothesis":"tighten routes.test 'rows from D1 propagate' from indexed-property check (body[0]?.id) to full array+sanitization check: pin id+name+auto_backup_headers_configured AND assert webhook_token is NOT present (positively verifies sanitization). End-to-end integration test for the sanitizeProject() contract.","next_idea":"audit lib-coverage.test for remaining patterns; or look at handler-response.test boolean assertions","perf_note":"752 ms median, stddev 12","win":"1 indexed-property test now positively pins sanitizeProject() integration contract"}}
{"run":151,"commit":"4508661","metric":745,"metrics":{"fail_runs":0,"stddev_ms":8,"test_count":627,"weak_tests":0},"status":"keep","description":"routes.test: tighten seed-test-project status-only to full TEST_PROJECT created envelope","timestamp":1777424752506,"segment":0,"confidence":151.6,"asi":{"hypothesis":"tighten routes.test 'POST /api/db/seed-test-project' from status-only to full body envelope (action:'created' + TEST_PROJECT id+token + cleanedBackups:0). End-to-end integration check that the worker correctly seeds the test project on first call.","next_idea":"audit cron-trigger 200 happy path; or restore success path test in routes","perf_note":"745 ms median, stddev 8","win":"1 status-only seed test now pins full TEST_PROJECT created-branch envelope"}}
{"run":152,"commit":"1ae04ef","metric":753,"metrics":{"fail_runs":0,"stddev_ms":5,"test_count":627,"weak_tests":0},"status":"keep","description":"routes.test: tighten cron-trigger 200 to full envelope (documents omit-results-when-empty)","timestamp":1777424806209,"segment":0,"confidence":151.6,"asi":{"hypothesis":"tighten routes.test 'POST /api/cron/trigger correct CRON_SECRET' from status-only to full envelope. KEY DISCOVERY: when no auto-backup projects exist, the cron-trigger response OMITS the `results` field entirely (instead of returning `results:[]`). This is a non-obvious contract — a CLI client expecting `results` to always be defined would break on empty-DB deployments.","next_idea":"audit log handler tests; or look at remaining routes.test 200 envelopes","perf_note":"753 ms median, stddev 5 (very stable)","win":"1 status-only test now pins full cron-summary envelope; documents the OMIT-results-when-empty contract"}}
{"run":153,"commit":"2da502c","metric":875,"metrics":{"fail_runs":0,"stddev_ms":68,"test_count":627,"weak_tests":0},"status":"keep","description":"webhook.test: tighten 2 201 success-path tests (zip key+contentType, senderIp surrounding context)","timestamp":1777424880743,"segment":0,"confidence":151.6,"asi":{"hypothesis":"tighten 2 webhook 201 success-path tests: zip-skips-preview (pin upload key prefix + content-type — catches stray-preview regression), senderIp-fallback (toMatchObject pinning the surrounding context fields). Both go from indexed-property checks to positive contracts.","next_idea":"audit handler-response.test boolean assertions; or look at remaining tests in apps/web","perf_note":"875 median is system-load skew (4 of 5 runs were 850+); 1 run was 747 — typical median should be ~750; change is test-only with no runtime overhead.","win":"+2 partial 201 tests now pin upload-content-type + senderIp surrounding-context contracts"}}
{"run":154,"commit":"74aff65","metric":752,"metrics":{"fail_runs":0,"stddev_ms":9,"test_count":627,"weak_tests":0},"status":"keep","description":"hosts.test: tighten 2 partial-membership tests to full Set + add positive complementary checks","timestamp":1777424932163,"segment":0,"confidence":159.57894736842104,"asi":{"hypothesis":"tighten 2 hosts.test partial-membership tests: (1) parseAllowedHosts contains-expected-hosts — was 2-of-3 .has() spot checks, now full sorted toEqual of all 3 parsed hosts (catches drop/extra/whitespace regressions); (2) does-not-contain-arbitrary — was 2 negative-only checks, ADDED 3 positive checks confirming the listed hosts ARE allowed (was implicit — a regression to isAllowedHost would not have surfaced).","next_idea":"audit ip.test for similar partial-membership tightenings; or look at the prompt-builder tests in projects.test","perf_note":"752 ms median, stddev 9 (very stable, near all-time best 725)","win":"+2 partial-membership tests now pin full Set + add positive complementary checks"}}
{"run":155,"commit":"d692e56","metric":742,"metrics":{"fail_runs":0,"stddev_ms":9,"test_count":627,"weak_tests":0},"status":"keep","description":"projects.test: tighten 8 500-status tests to distinct user-facing error messages","timestamp":1777425030213,"segment":0,"confidence":151.6,"asi":{"hypothesis":"tighten 8 projects.test 500-status-only tests (list/create/get/update/delete/regenerateToken/projectPrompt 500 + 1 prompt 404). Each surfaces a DISTINCT user-facing error message ('Failed to list/create/get/update/delete projects', 'Failed to regenerate token', 'Failed to generate prompt'). Pinning these prevents a refactor that collapses them all into a generic 'Internal server error'.","next_idea":"audit packages/api d1-binding-adapter or webhook-logs handler tests; or look at ip.test 0.0.0.0/0 edge cases","perf_note":"742 ms median, stddev 9 (very stable, near all-time best 725)","win":"+8 status-only tests now positively pin distinct user-facing error messages; projects handler now 100% body-coverage on errors"}}
{"run":156,"commit":"d686b02","metric":745,"metrics":{"fail_runs":0,"stddev_ms":6,"test_count":627,"weak_tests":0},"status":"keep","description":"categories+live: tighten last 2 status-only tests; packages/api/handlers/* now 100% body-coverage","timestamp":1777425106641,"segment":0,"confidence":159.57894736842104,"asi":{"hypothesis":"tighten 2 tests: categories delete-500 (Failed-to-delete-category msg), live non-Error-throw (pin d1.message default 'D1 unreachable' fires when thrown value isn't Error). The live test specifically catches a regression where the impl crashes on `throw 'raw'` instead of substituting the default message.","next_idea":"audit cron handler 200 success paths for any non-comprehensive body checks; or look at remaining apps/web partial assertions","perf_note":"745 ms median, stddev 6 (very stable, near all-time best 725)","win":"+2 status-only tests now pin distinct user-facing error messages; ALL packages/api/handlers/* now have 100% body-coverage on every test"}}
{"run":157,"commit":"f0dbb93","metric":743,"metrics":{"fail_runs":0,"stddev_ms":3,"test_count":627,"weak_tests":0},"status":"keep","description":"cli/index.test: tighten 4 toContain partial assertions to exact toBe placeholder strings","timestamp":1777425176289,"segment":0,"confidence":168.44444444444446,"asi":{"hypothesis":"tighten 4 cli/index.test partial-substring assertions to full toBe (--version, -v, no-flags, process.argv-fallback). The partial toContain('@backy/cli') would pass for any string starting with '@backy/cli...' incl. wrong messages — toBe pins the exact placeholder copy.","next_idea":"audit access-auth happy-path 200 tests (10 of them — all assert status only); or look at remaining patterns in apps/web","perf_note":"743 ms median, stddev 3 (very stable, near all-time best 725)","win":"+4 partial-substring tests now pin exact placeholder copy"}}
{"run":158,"commit":"d596cc2","metric":779,"metrics":{"fail_runs":0,"stddev_ms":43,"test_count":627,"weak_tests":0},"status":"keep","description":"access-auth.test: tighten 6 public-path tests to verify reached-downstream contract","timestamp":1777425229247,"segment":0,"confidence":159.57894736842104,"asi":{"hypothesis":"tighten 6 access-auth public-path tests to verify the request reached the downstream handler (vs short-circuited 200 from middleware itself). Pin {ok:true, email:null} body for JSON responses (5 tests) and empty-body for HEAD (1 test). Catches a regression where accessAuth pre-empts the downstream and synthesizes a 200 response.","next_idea":"audit handler-response.test or any remaining test files; or look at remaining packages/api hosts buildBaseUrl tests","perf_note":"779 median; 1 outlier 876 (system spike). Change is test-only.","win":"+6 status-only public-path tests now positively confirm 'reached downstream handler' contract"}}
{"run":159,"commit":"571aba2","metric":886,"metrics":{"fail_runs":0,"stddev_ms":85,"test_count":627,"weak_tests":0},"status":"keep","description":"id.test: tighten URL-safe-chars regex to also pin length (defense-in-depth)","timestamp":1777425301217,"segment":0,"confidence":151.6,"asi":{"hypothesis":"tighten 2 id.test URL-safe-chars regex tests to ALSO pin length in one regex (^[A-Za-z0-9_-]{21}$ for id, {48}$ for token). Defense-in-depth: even if someone deletes the standalone length test, the URL-safe test still pins length.","next_idea":"audit packages/api file-type.test or remaining patterns; or look at scan-weak-tests.ts for new heuristics","perf_note":"886 median is system-load skew (3 runs >850ms, 2 at 756/761 — normal); change is test-only","win":"+2 regex tests now pin BOTH alphabet AND length; defensive against test-deletion"}}
{"run":160,"commit":"56087a6","metric":765,"metrics":{"fail_runs":0,"stddev_ms":22,"test_count":627,"weak_tests":0},"status":"keep","description":"db.test: tighten 2 seed-branch toMatchObject to full toEqual (pin TEST_PROJECT id+token)","timestamp":1777425409383,"segment":0,"confidence":159.57894736842104,"asi":{"hypothesis":"tighten 2 db.test seed-branch tests from toMatchObject (allows extra fields) to toEqual full envelope incl. TEST_PROJECT id+token: seed-verifies-clean (verified branch), seed-cleans-orphaned (created branch with cleanedBackups:1). Catches a regression that drops projectId/webhookToken from these branches — would break E2E callers that round-trip the token.","next_idea":"audit any remaining toMatchObject patterns elsewhere; or look at scan-weak-tests.ts heuristic improvements","perf_note":"765 ms median, stddev 22","win":"+2 partial-shape (toMatchObject) tests now full toEqual; pin every field surfaced by seed branches"}}
{"run":161,"commit":"fd4352a","metric":744,"metrics":{"fail_runs":0,"stddev_ms":14,"test_count":627,"weak_tests":0},"status":"keep","description":"webhook-logs.test: tighten 2 console.error assertions to pin prefix string (log-aggregation contract)","timestamp":1777425494774,"segment":0,"confidence":151.6,"asi":{"hypothesis":"tighten 2 webhook-logs.test 'does-not-throw-on-failure' tests — ADD assertion on the console.error prefix message ('Webhook log write failed:') to catch a refactor that changes the log-format string (which would silently break log-aggregation alerts).","next_idea":"audit cron-logs.test for similar console.error coverage; or look at remaining patterns","perf_note":"744 ms median, stddev 14 (very stable, near all-time best 725)","win":"+2 fire-and-forget error tests now pin the console-log prefix string; protects log-aggregation contract"}}
{"run":162,"commit":"89f97df","metric":758,"metrics":{"fail_runs":0,"stddev_ms":7,"test_count":627,"weak_tests":0},"status":"keep","description":"webhook.test: consolidate 4 webhookGet body property checks into full envelope toEqual","timestamp":1777425597154,"segment":0,"confidence":159.57894736842104,"asi":{"hypothesis":"tighten webhookGet 200-recent-backups test: 4 single-property checks (project_name, environment-null, total_backups, recent-toEqual) consolidated into ONE toEqual on the full body envelope. Catches a regression that adds a stray top-level field (e.g. webhook_token or sender_ip leak) OR drops one of the surfaced fields.","next_idea":"audit any remaining tests; or consider if there are runtime.ts paths to explicitly test","perf_note":"758 ms median, stddev 7 (very stable, near all-time best 725)","win":"1 4-property test consolidated to full envelope toEqual; catches stray-field leak"}}
{"run":163,"commit":"71b50b2","metric":749,"metrics":{"fail_runs":0,"stddev_ms":9,"test_count":627,"weak_tests":0},"status":"keep","description":"webhook.test: consolidate environment-filter test (full envelope + forwarded-options contract)","timestamp":1777425647689,"segment":0,"confidence":168.44444444444446,"asi":{"hypothesis":"tighten webhookGet 200-environment-filter test: 2 single-property checks (captured.environment + body.environment) consolidated to: (a) captured-options toMatchObject with projectId+environment to verify forwarding contract, (b) full body toEqual with all 4 fields. Documents the recent_backups:[] (empty array, NOT omitted) contract when items=[].","next_idea":"audit 5 cron handler 200 happy paths with partial body checks; or look at remaining patterns","perf_note":"749 ms median, stddev 9 (very stable, near all-time best 725)","win":"1 partial-property test consolidated; documents recent_backups-empty-array contract"}}
{"run":164,"commit":"d770c17","metric":752,"metrics":{"fail_runs":0,"stddev_ms":5,"test_count":627,"weak_tests":0},"status":"keep","description":"restore.test: consolidate 5 200-presigned property checks into full envelope toEqual","timestamp":1777425700821,"segment":0,"confidence":159.57894736842104,"asi":{"hypothesis":"tighten restore.test 200-presigned-URL test: 5 single-property checks consolidated into ONE toEqual on the full presign response envelope. Catches a regression that adds a stray field (e.g. accidentally including the project's webhook_token alongside) or drops one of the 5 surfaced fields.","next_idea":"audit the second restore 200 (query-param) path for similar consolidation; or look at remaining cron success-path tests","perf_note":"752 ms median, stddev 5 (very stable, near all-time best 725)","win":"1 5-property test consolidated to full toEqual envelope contract"}}
{"run":165,"commit":"b61ee8a","metric":742,"metrics":{"fail_runs":0,"stddev_ms":5,"test_count":627,"weak_tests":0},"status":"keep","description":"restore.test: tighten last 500-status-only test; restoreHandler 100% body-coverage","timestamp":1777425743722,"segment":0,"confidence":168.44444444444446,"asi":{"hypothesis":"tighten restore.test 500-on-getBackup-throws status-only test to also pin the user-facing 'Failed to generate restore URL' error body. restoreHandler now has 100% body coverage on every status branch.","next_idea":"audit cron handler 200 success-path tests where partial body assertions remain","perf_note":"742 ms median, stddev 5 (very stable, near all-time best 725)","win":"+1 status-only restore-500 test pinned; restoreHandler now 100% body-coverage on all 13 tests"}}
{"run":166,"commit":"300eba8","metric":742,"metrics":{"fail_runs":0,"stddev_ms":4,"test_count":627,"weak_tests":0},"status":"keep","description":"projects.test: tighten last 2 404-status-only tests; projects handler 100% body-coverage","timestamp":1777425836679,"segment":0,"confidence":168.44444444444446,"asi":{"hypothesis":"tighten 2 last status-only 404 tests in projects.test (getProject 404 + updateProject 404). Both surface the same 'Project not found' message — pin to confirm. projects handler now 100% body-coverage.","next_idea":"audit the remaining 400 tests in update path; or look for any partial body checks in webhook/cron 200 paths","perf_note":"742 ms median, stddev 4 (very stable, near all-time best 725)","win":"+2 status-only 404s pinned; projects.test 100% body-coverage"}}
{"run":167,"commit":"8b2cdcb","metric":738,"metrics":{"fail_runs":0,"stddev_ms":2,"test_count":627,"weak_tests":0},"status":"keep","description":"projects.test: tighten 2 updateProject 400 tests (invalid-CIDR + unsafe-webhook bodies)","timestamp":1777425891862,"segment":0,"confidence":168.44444444444446,"asi":{"hypothesis":"tighten 2 updateProject 400 status-only tests: invalid-allowed_ips (pin error+invalid:['not-an-ip'] array — the invalid array helps callers identify which CIDRs to fix), unsafe-webhook (pin same SSRF guard message as cron handler).","next_idea":"audit any remaining cron handler 200 tests; or look at remaining 400 in other handlers","perf_note":"738 ms median, stddev 2 (very stable, near all-time best 725)","win":"+2 status-only 400 tests pinned; documents the invalid-CIDR-array contract for caller diagnostics"}}
{"run":168,"commit":"7ad7143","metric":750,"metrics":{"fail_runs":0,"stddev_ms":5,"test_count":627,"weak_tests":0},"status":"keep","description":"projects.test: tighten updateProject 200 to assert sanitization contract (no webhook_token leak)","timestamp":1777425945948,"segment":0,"confidence":168.44444444444446,"asi":{"hypothesis":"tighten updateProject 200-on-valid-update test: status-only → also assert response is the SANITIZED project (no webhook_token + auto_backup_headers_configured derived). Catches a regression that returns the raw project (token leak) — the same security-sensitive contract the sanitize.test allowlist test pins at the lib layer.","next_idea":"audit cron handler 200 success paths; or look for any remaining response-shape contracts to pin","perf_note":"750 ms median, stddev 5 (very stable, near all-time best 725)","win":"1 status-only success test now positively pins sanitization integration contract (no webhook_token leak via update)"}}
{"run":169,"commit":"27afe7f","metric":751,"metrics":{"fail_runs":0,"stddev_ms":7,"test_count":628,"weak_tests":0},"status":"keep","description":"handler-response.test: ADD empty-with-headers test (surfaces real toResponse() bug, logged in ideas)","timestamp":1777426031766,"segment":0,"confidence":168.44444444444446,"asi":{"hypothesis":"ADD handler-response.test 'empty with headers' test — covers a previously-untested branch. KEY DISCOVERY: toResponse() for the 'empty' kind drops headers because they're spread directly into ResponseInit instead of into a nested `headers` property (json/bytes/text correctly nest them). webhookHeadHandler returning empty(200, {'X-Project-Name': ...}) would silently drop the X-Project-Name header in production. Bug logged in ideas.md. Test currently pins the BUG behavior so a fix must update both.","next_idea":"audit cron handler tests for any partial 200 paths; or look for similar dead-code bugs in other handlers","perf_note":"751 ms median, stddev 7 (very stable, near all-time best 725)","win":"ADDED 1 test covering an untested branch; SURFACED a real production bug in toResponse handler (empty-with-headers drops headers)"}}
{"run":170,"commit":"8b2b629","metric":923,"metrics":{"fail_runs":0,"stddev_ms":103,"test_count":628,"weak_tests":0},"status":"keep","description":"categories.test: tighten 3 500-status-only tests; categories handler 100% body-coverage","timestamp":1777426110238,"segment":0,"confidence":168.44444444444446,"asi":{"hypothesis":"tighten 3 categories handler 500 status-only tests (create/get/update). Each surfaces a DISTINCT 'Failed to X category' message — pinning prevents collapsing into a generic message. Categories handler now 100% body-coverage on every test.","next_idea":"audit cron cron-trigger-summary 200 success path tests; or look at extractors size-limit reason templates","perf_note":"923 median is heavy system load (1114, 942, 923, 902 — only 1 run at 791); change is test-only.","win":"+3 status-only tests pinned; categories handler now 100% body-coverage"}}
{"run":171,"commit":"2d885be","metric":749,"metrics":{"fail_runs":0,"stddev_ms":2,"test_count":628,"weak_tests":0},"status":"keep","description":"storage.test: tighten generatePreviewKey auto-timestamp to full-shape regex","timestamp":1777426226403,"segment":0,"confidence":168.44444444444446,"asi":{"hypothesis":"tighten storage.test 'generatePreviewKey auto-generates timestamp' from 2 startsWith/endsWith partial checks to 1 full-shape regex pinning the entire previews/<projectId>/<timestamp>.json contract. Catches a regression that prefixes the project id differently or uses a non-Z timestamp suffix.","next_idea":"audit any remaining patterns; perf has been stable for 50+ experiments at 740-755ms","perf_note":"749 ms median, stddev 2 (very stable, near all-time best 725)","win":"1 partial-shape test now pin full preview-key contract via regex"}}
{"run":172,"commit":"$(git r","metric":770,"metrics":{"fail_runs":0,"stddev_ms":5,"test_count":628,"weak_tests":0},"status":"discard","description":"no-op stability rerun (no changes; baseline check)","timestamp":1777426320087,"segment":0,"confidence":168.44444444444446,"asi":{"hypothesis":"no-op rerun for stability baseline (no test changes since last). Confirms 770 ± 5 ms is the current floor on this hardware.","next_idea":"session is at strong plateau — all heuristics 0, every handler test has body coverage, real bugs surfaced. Could continue on lib coverage but diminishing returns.","perf_note":"770 ms median, stddev 5 — stable","win":"no-op stability check; no-changes confirmed-floor"}}
