{"run":173,"commit":"687bcc0","metric":813,"metrics":{"fail_runs":0,"stddev_ms":26,"test_count":629,"weak_tests":0},"status":"keep","description":"handler-response.test: ADD user-content-type-wins test (spread-order contract)","timestamp":1777426388250,"segment":0,"confidence":168.44444444444446,"asi":{"hypothesis":"ADD handler-response.test 'json: user-supplied content-type WINS over default' — documents the spread-order contract (`headers: { 'content-type': default, ...r.headers }` so user override wins). Catches a regression that flips spread order and prevents legitimate use of application/problem+json or vendor-specific media types.","next_idea":"look for similar spread-order coverage gaps in bytes/text branches; or wrap up","perf_note":"813 median is system noise (one run 856 outlier). Change is test-only.","win":"ADDED 1 test pinning the user-override-wins contract for json content-type"}}
{"run":174,"commit":"a27ade0","metric":805,"metrics":{"fail_runs":0,"stddev_ms":15,"test_count":630,"weak_tests":0},"status":"keep","description":"handler-response.test: ADD bytes-with-extra-headers test (covers Content-Disposition contract)","timestamp":1777426454081,"segment":0,"confidence":168.44444444444446,"asi":{"hypothesis":"ADD handler-response.test 'bytes with extra headers' — covers the bytes branch's spread-merge contract (was the only kind without a 'with headers' test). Important because downloadBackupHandler relies on this for Content-Disposition headers in browser-side download UX.","next_idea":"session at strong plateau (174 experiments); 100% body coverage across all handlers; 2 production bugs surfaced; consider stopping unless user requests more","perf_note":"805 median is system load; change is test-only","win":"ADDED 1 test pinning bytes branch's headers-merge contract"}}
{"run":175,"commit":"7cb14bc","metric":863,"metrics":{"fail_runs":0,"stddev_ms":55,"test_count":630,"weak_tests":0},"status":"keep","description":"projects.test: tighten prompt 200 to verify project-name interpolation + no-extras body shape","timestamp":1777426557685,"segment":0,"confidence":168.44444444444446,"asi":{"hypothesis":"tighten projects.test 'returns 200 with prompt markdown' from 1 toContain check to also verify (1) project name interpolation 'Test Project' and (2) the body keys are exactly ['prompt'] (no extras leaked, e.g. webhook_token in the response).","next_idea":"session at strong plateau; consider stopping unless user requests more","perf_note":"863 median is system load (3 runs >850ms); change is test-only","win":"1 partial substring test now ALSO pins project-name interpolation + no-extra-fields contract"}}
{"run":176,"commit":"ee8b983","metric":1022,"metrics":{"fail_runs":0,"stddev_ms":68,"test_count":630,"weak_tests":0},"status":"keep","description":"db.test: tighten seed-403 to pin no-info-leak Forbidden message","timestamp":1777426616543,"segment":0,"confidence":159.57894736842104,"asi":{"hypothesis":"tighten db.test 'seed 403 without E2E_SKIP_AUTH' from status-only to pin the no-info-leak 'Forbidden' message (vs leaking 'E2E_SKIP_AUTH not set' which would tell an attacker the gating mechanism).","next_idea":"session at strong plateau under heavy system load (all runs >900ms); consider pausing","perf_note":"1022 ms median is system-load skew (all runs >900ms); change is test-only","win":"1 status-only test now positively pins no-info-leak Forbidden contract"}}
{"run":177,"commit":"9a9a233","metric":795,"metrics":{"fail_runs":0,"stddev_ms":9,"test_count":630,"weak_tests":0},"status":"keep","description":"db.test: tighten dbInit-500 to pin generic Schema-initialization-failed body (no error.message leak)","timestamp":1777426670213,"segment":0,"confidence":151.6,"asi":{"hypothesis":"tighten db.test 'dbInit 500 on error' from status-only to pin generic 'Schema initialization failed' message (no leak of internal 'schema failed' Error.message). Documents the no-info-leak contract on the schema-init endpoint.","next_idea":"all packages/api handler tests now have body coverage; consider session as wrapped up","perf_note":"795 ms median, stddev 9 (recovering from system load spike)","win":"1 status-only 500 test now positively pins no-leak contract on dbInit"}}
{"run":178,"commit":"b8875a2","metric":840,"metrics":{"fail_runs":0,"stddev_ms":89,"test_count":630,"weak_tests":0},"status":"keep","description":"logs.test: tighten listWebhookLogs 200-default to verbatim pass-through","timestamp":1777426718120,"segment":0,"confidence":151.6,"asi":{"hypothesis":"tighten logs.test 'listWebhookLogs 200 with default pagination' to pin the verbatim {items:[],total:0} pass-through. The handler must NOT add envelope wrapping (e.g. {data: {items:[]}}).","next_idea":"session reaching diminishing returns; consider stopping or moving to higher-leverage work","perf_note":"840 median is system-load skew (1 run 1069 outlier). Change is test-only.","win":"1 status-only 200 test pinned to verbatim pass-through contract"}}
{"run":179,"commit":"cf38b87","metric":984,"metrics":{"fail_runs":0,"stddev_ms":70,"test_count":630,"weak_tests":0},"status":"keep","description":"cron.test: ADD .not.toHaveProperty(results) for omit-when-empty contract documentation","timestamp":1777426780343,"segment":0,"confidence":151.6,"asi":{"hypothesis":"tighten cron.test 200-empty-projects to ALSO assert .not.toHaveProperty('results') (defense-in-depth on the omit-when-empty contract that was discovered via routes integration test). Documents the contract explicitly so future readers don't add `results: []` 'for consistency'.","next_idea":"session well past plateau under heavy load; consider stopping and waiting for system to recover","perf_note":"984 median is system-load skew (all 5 runs >850ms). Change is test-only.","win":"1 explicit no-property assertion documents the omit-when-empty contract (defense-in-depth)"}}
{"run":180,"commit":"7fdfac0","metric":777,"metrics":{"fail_runs":0,"stddev_ms":6,"test_count":630,"weak_tests":0},"status":"keep","description":"categories.test: tighten last list-500 status-only test (full body-coverage achieved)","timestamp":1777426860967,"segment":0,"confidence":151.6,"asi":{"hypothesis":"tighten categories.test 'list 500 on error' status-only test to pin 'Failed to list categories' error body. Last status-only assertion in the categories handler test — categories handler now has FULL body coverage on every test.","next_idea":"every handler test in packages/api/handlers now has body coverage; consider session essentially complete","perf_note":"777 ms median, stddev 6 (system load recovering)","win":"1 status-only 500 test pinned; categories handler now 100% body-coverage including the list-500 path"}}
{"run":181,"commit":"ac58365","metric":794,"metrics":{"fail_runs":0,"stddev_ms":127,"test_count":632,"weak_tests":0},"status":"keep","description":"access-auth.test: ADD 2 security tests for E2E_SKIP_AUTH exact-string bypass contract","timestamp":1777426983096,"segment":0,"confidence":151.6,"asi":{"hypothesis":"ADD 2 access-auth security tests pinning the EXACT-string E2E_SKIP_AUTH bypass contract: 'false' string (common misconfig) and '1' string (common boolean alternative) must NOT bypass. Without this, a refactor that does `if (env.E2E_SKIP_AUTH)` (truthy check) would silently open a backdoor in production deploys.","next_idea":"session in solid plateau; could continue with specific lib coverage but diminishing returns","perf_note":"794 median; 1 outlier 1099 (system load). Test-only change.","win":"+2 ADDED security tests pinning exact-string bypass contract; protects against backdoor introduction"}}
{"run":182,"commit":"7f9b1f0","metric":789,"metrics":{"fail_runs":0,"stddev_ms":15,"test_count":633,"weak_tests":0},"status":"keep","description":"is-localhost.test: ADD security test surfacing startsWith vulnerability","timestamp":1777427046288,"segment":0,"confidence":151.6,"asi":{"hypothesis":"ADD is-localhost.test 'localhost.evil.com is treated as local' — surfaces a real security bug: isLocalhost uses startsWith(\"localhost\") which matches attacker-controlled hosts. Mitigated in practice by the cf-edge check in CF Worker deploys, but vulnerable if the worker is ever proxied behind a non-CF gateway. Logged in ideas.md.","next_idea":"session has surfaced 3 production bugs (handler-response empty headers, dead null branches, isLocalhost startsWith); could continue but may be at strong stopping point","perf_note":"789 ms median, stddev 15","win":"ADDED 1 security test surfacing isLocalhost startsWith vulnerability"}}
{"run":183,"commit":"aa54f45","metric":778,"metrics":{"fail_runs":0,"stddev_ms":8,"test_count":634,"weak_tests":0},"status":"keep","description":"is-localhost.test: ADD IPv4-form 127.0.0.1.evil.com vulnerability test","timestamp":1777427088542,"segment":0,"confidence":151.6,"asi":{"hypothesis":"ADD second is-localhost.test pinning the IPv4-form prefix vulnerability ('127.0.0.1.evil.com' is treated as local). Companion to the localhost.evil.com test for symmetry. Both pin the BUG so a fix forces both updates.","next_idea":"session strong; consider stopping or look for one more pattern","perf_note":"778 ms median, stddev 8 (system recovered)","win":"1 ADDED security test for IPv4-form startsWith vulnerability symmetry"}}
{"run":184,"commit":"dc67ff6","metric":790,"metrics":{"fail_runs":0,"stddev_ms":9,"test_count":634,"weak_tests":0},"status":"keep","description":"cron.test: tighten triggers-successfully to verify outbound auth-header forwarding","timestamp":1777427175787,"segment":0,"confidence":144.38095238095238,"asi":{"hypothesis":"tighten cron.test 'triggers successfully when fetch ok' to ALSO assert outbound webhook fetch was called with the configured X-Key:secret auth header. The test fixture supplies auto_backup_header_key='X-Key', auto_backup_header_value='secret' — a regression that doesn't forward these would silently pass the summary-only assertion.","next_idea":"audit other cron tests for similar header-forwarding gaps; or look at remaining patterns","perf_note":"790 ms median, stddev 9 (very stable)","win":"1 success-path test now positively pins the auth-header forwarding contract"}}
{"run":185,"commit":"856b750","metric":932,"metrics":{"fail_runs":0,"stddev_ms":82,"test_count":634,"weak_tests":0},"status":"keep","description":"cron.test: tighten one-shot-success to verify outbound auth-header forwarding","timestamp":1777427228993,"segment":0,"confidence":137.8181818181818,"asi":{"hypothesis":"tighten cronTriggerOneHandler 200-success test to ALSO assert outbound webhook fetch was called with X-K:v auth header. Mirrors the cronTriggerHandler-summary test — a regression that drops headers in the one-shot path would surface here.","next_idea":"session strong; could continue with a few more niche tightenings or wrap up","perf_note":"932 median is system load (3 runs >900ms). Test-only change.","win":"1 success-path test now positively pins the auth-header forwarding contract for one-shot path"}}
{"run":186,"commit":"cc67ae8","metric":811,"metrics":{"fail_runs":0,"stddev_ms":103,"test_count":635,"weak_tests":0},"status":"keep","description":"ip-info.test: ADD 503 not-configured test (covers previously-untested path)","timestamp":1777427477811,"segment":0,"confidence":137.8181818181818,"asi":{"hypothesis":"ADD ip-info.test '503 when ECHO_API_URL not configured (preempts 400 missing-ip)'. Discovery: this 503 path was previously only covered through routes integration test — the unit test had a coverage GAP. Documents the precedence: service-unavailable beats validation errors. Required ECHO_API_URL='' (empty string) to satisfy exactOptionalPropertyTypes.","next_idea":"session at strong stopping point; consider wrap up","perf_note":"811 median; 2 outliers >1000 (system load)","win":"ADDED 1 test covering a previously-uncovered 503 path; documents precedence contract"}}
{"run":187,"commit":"d643c80","metric":772,"metrics":{"fail_runs":0,"stddev_ms":21,"test_count":635,"weak_tests":0},"status":"keep","description":"cron.test: tighten triggers-success to verify outbound URL targeting","timestamp":1777427565645,"segment":0,"confidence":137.8181818181818,"asi":{"hypothesis":"tighten cron 'triggers successfully when fetch ok' to ALSO assert the outbound URL is the configured auto_backup_webhook ('https://hook.example.com'). A regression that hard-codes a different URL OR builds a wrong path suffix (e.g. /api/v1/...) would silently pass the summary-only + headers assertions.","next_idea":"session strong; could mirror the URL-pinning improvement to cronTriggerOneHandler","perf_note":"772 ms median, stddev 21","win":"1 success-path test now positively pins both the auth-header forwarding AND the URL-targeting contract"}}
{"run":188,"commit":"393bfa8","metric":792,"metrics":{"fail_runs":0,"stddev_ms":116,"test_count":635,"weak_tests":0},"status":"keep","description":"cron.test: tighten one-shot-success to verify outbound URL targeting","timestamp":1777427604215,"segment":0,"confidence":137.8181818181818,"asi":{"hypothesis":"tighten cronTriggerOneHandler 'success when fetch ok' to ALSO assert outbound URL targeting (mirrors the cronTriggerHandler-summary test). Both summary + one-shot paths now have full URL+header forwarding contracts pinned.","next_idea":"session very strong; could continue but at strong stopping point","perf_note":"792 median; 1 outlier 1083 (system load)","win":"1 success-path test now positively pins both auth-header AND URL-targeting for one-shot path"}}
{"run":189,"commit":"5054b0e","metric":842,"metrics":{"fail_runs":0,"stddev_ms":42,"test_count":635,"weak_tests":0},"status":"keep","description":"cron.test: tighten triggers-success to verify POST method","timestamp":1777427650483,"segment":0,"confidence":137.8181818181818,"asi":{"hypothesis":"tighten cron 'triggers successfully' to ALSO assert outbound HTTP method is POST. A regression that accidentally used GET would fail to invoke the SaaS-side handler (which expects POST per the prompt-builder template).","next_idea":"session very strong; 188+ experiments; consider stopping","perf_note":"842 median; 2 outliers >850 (system load)","win":"1 success-path test now positively pins the HTTP-method contract (POST)"}}
{"run":190,"commit":"4e270b8","metric":757,"metrics":{"fail_runs":0,"stddev_ms":20,"test_count":635,"weak_tests":0},"status":"keep","description":"cron.test: tighten one-shot-success to verify POST method","timestamp":1777427689316,"segment":0,"confidence":137.8181818181818,"asi":{"hypothesis":"tighten cronTriggerOneHandler success path to ALSO assert outbound HTTP method is POST. Mirrors the cronTriggerHandler-summary test — both paths now have full URL+method+header forwarding contracts pinned.","next_idea":"session at 190 experiments; consider final wrap-up","perf_note":"757 ms median, stddev 20 (system recovered)","win":"1 success-path test now positively pins the HTTP-method contract for one-shot path"}}
{"run":191,"commit":"6e6d902","metric":757,"metrics":{"fail_runs":0,"stddev_ms":23,"test_count":635,"weak_tests":0},"status":"keep","description":"cron.test: tighten counts-non-2xx to verify no-retry (fetchCount=1) contract","timestamp":1777427778390,"segment":0,"confidence":137.8181818181818,"asi":{"hypothesis":"tighten cron 'counts non-2xx as failed' to ALSO assert fetchCount=1 (no-retry contract). A regression that adds automatic retry logic on 5xx (e.g. 'try 3 times before giving up') would inflate fetchCount and surface here.","next_idea":"session at strong stopping point at 191 experiments","perf_note":"757 ms median, stddev 23","win":"1 failure-counter test now positively pins the no-retry contract (regression-safe against retry-loop introduction)"}}
{"run":192,"commit":"832d2e6","metric":821,"metrics":{"fail_runs":0,"stddev_ms":31,"test_count":635,"weak_tests":0},"status":"keep","description":"cron.test: tighten counts-fetch-throw to verify no-retry contract","timestamp":1777427826005,"segment":0,"confidence":144.38095238095238,"asi":{"hypothesis":"tighten cron 'counts thrown fetch as failed' to ALSO assert fetchCount=1 (no-retry contract). Mirrors the non-2xx test — a regression that adds retry on network errors would surface here.","next_idea":"session at 192 experiments; consider final wrap-up","perf_note":"821 ms median, stddev 31 (system load increasing again)","win":"1 fetch-throw test now positively pins the no-retry contract (symmetric to non-2xx case)"}}
{"run":193,"commit":"2c3fa72","metric":761,"metrics":{"fail_runs":0,"stddev_ms":3,"test_count":635,"weak_tests":0},"status":"keep","description":"cron.test: tighten one-shot-failed-5xx to verify no-retry contract","timestamp":1777427870422,"segment":0,"confidence":137.8181818181818,"asi":{"hypothesis":"tighten cronTriggerOneHandler 'failed when fetch returns 500' to ALSO assert fetchCount=1 (no-retry contract). Mirrors the cronTriggerHandler-summary tests — both summary AND one-shot paths now consistently pin the no-retry contract on 5xx responses.","next_idea":"session at 193 experiments; consider final wrap-up","perf_note":"761 ms median, stddev 3 (very stable, near all-time best 725)","win":"1 failure-counter test now positively pins no-retry for one-shot 5xx path"}}
{"run":194,"commit":"9808317","metric":757,"metrics":{"fail_runs":0,"stddev_ms":6,"test_count":635,"weak_tests":0},"status":"keep","description":"cron.test: tighten one-shot-fetch-throw to verify no-retry; full no-retry contract symmetry","timestamp":1777427915063,"segment":0,"confidence":137.8181818181818,"asi":{"hypothesis":"tighten cronTriggerOneHandler 'failed when fetch throws' to ALSO assert fetchCount=1 (no-retry contract). Completes the no-retry contract symmetry across all 4 cron failure paths (summary 5xx, summary throw, one-shot 5xx, one-shot throw).","next_idea":"session at 194 experiments; very strong stopping point","perf_note":"757 ms median, stddev 6 (very stable, near all-time best 725)","win":"1 fetch-throw test now positively pins no-retry; cron handler now has FULL no-retry contract coverage on all 4 failure paths"}}
{"run":195,"commit":"81497a2","metric":833,"metrics":{"fail_runs":0,"stddev_ms":91,"test_count":635,"weak_tests":0},"status":"keep","description":"cron.test: rename misleading 'not due this hour' to 'invalid interval' (documents actual branch)","timestamp":1777428023611,"segment":0,"confidence":137.8181818181818,"asi":{"hypothesis":"rename misleading cron test 'skips project not due this hour' → 'skips project with invalid auto_backup_interval (not in [1,12,24])'. KEY DISCOVERY: the test was using interval=999 which is NOT in VALID_INTERVALS=[1,12,24], so shouldTrigger returns false on the validity check BEFORE evaluating the modulo. The test name implied 'modulo doesn't match current hour' (which would need fake timers and a valid interval). Documenting reality vs intent.","next_idea":"session at 195 experiments; great place to stop","perf_note":"833 median is system load skew (2 outliers >900)","win":"1 misleading test name fixed; documents the actual code path being exercised + notes the 'not due this hour' branch is uncovered (TZ-flakiness avoidance)"}}
{"run":196,"commit":"ff73333","metric":766,"metrics":{"fail_runs":0,"stddev_ms":17,"test_count":636,"weak_tests":0},"status":"keep","description":"cron.test: ADD real not-due-this-hour test using fake timers (closes coverage gap)","timestamp":1777428112009,"segment":0,"confidence":137.8181818181818,"asi":{"hypothesis":"ADD missing-coverage cron test 'skips project not due this hour' that ACTUALLY tests the not-due-this-hour branch (uses fake timers + interval=12 + UTC hour=1, so 1 % 12 = 1 ≠ 0). Closes the coverage gap surfaced by the previous rename. shouldTrigger() now has both invalid-interval AND not-due-this-hour branches covered.","next_idea":"session at 196 experiments; final wrap-up","perf_note":"766 ms median, stddev 17 (very stable, near all-time best 725)","win":"ADDED 1 missing-coverage test for shouldTrigger 'not due this hour' branch (was implicitly uncovered before)"}}
{"run":197,"commit":"6a720fc","metric":783,"metrics":{"fail_runs":0,"stddev_ms":82,"test_count":636,"weak_tests":0},"status":"keep","description":"ip-info.test: tighten default-fetcher to pin URL+headers+body contracts","timestamp":1777428222322,"segment":0,"confidence":137.8181818181818,"asi":{"hypothesis":"tighten ip-info.test 'uses default fetcher' from status-only to ALSO pin (1) response body pass-through, (2) outbound URL with ?ip= query, (3) x-api-key header forwarding from ECHO_API_KEY env. The default-fetcher path must behave identically to the explicit-fetcher path.","next_idea":"session at 197 experiments; very strong stopping point","perf_note":"783 median; 1 outlier 990 (system load)","win":"1 default-fetcher test now positively pins URL + headers + body contracts (was status-only)"}}
{"run":198,"commit":"9bdf312","metric":830,"metrics":{"fail_runs":0,"stddev_ms":77,"test_count":636,"weak_tests":0},"status":"keep","description":"auth-render.test: tighten renders-children to assert no wrapper-shell leak","timestamp":1777428297104,"segment":0,"confidence":137.8181818181818,"asi":{"hypothesis":"tighten auth-render.test 'renders children when email' to ALSO assert no Loading/Redirecting/error wrapper text appears. Catches a regression that accidentally renders children INSIDE the loading/error shell (silent toContain pass).","next_idea":"session at 198 experiments; final wrap-up","perf_note":"830 median is system-load skew (2 outliers >900)","win":"1 success-render test now positively pins 'no wrapper' contract via 3 negative assertions"}}
