{"run":224,"commit":"587da33","metric":757,"metrics":{"fail_runs":0,"stddev_ms":111,"test_count":660,"weak_tests":0},"status":"keep","description":"access-auth.test: REVERT JWT-success vi.mock(jose) tests (flaky under contention)","timestamp":1777431298300,"segment":0,"confidence":126.33333333333333,"asi":{"hypothesis":"REVERT 3 access-auth tests added in #214/#215 (vi.mock(jose) approach). Confirmed flaky: 2/8 N=4 runs failed all 3 retries with 'expected 401 to be 200'. Hypothesis: vi.mock(jose) hoisted factory + isolate:false + parallel workspace contention causes intermittent module-cache races where the mock isn't fully replaced when first request arrives. retry:3 doesn't help — once broken, the test process stays broken. 10/10 clean after revert.","next_idea":"session at 224; access-auth tests removed for stability; add back via separate file with isolate:true if pursued later","perf_note":"757 ms median, stddev 111 (one slow run skewed)","rollback_reason":"test reliability > coverage gain; access-auth.ts back to 87.5% but 0/10 flakes vs 2/8","win":"test reliability restored; documented the failure mode in autoresearch.ideas.md"}}
{"run":225,"commit":"1f02cb4","metric":741,"metrics":{"fail_runs":0,"stddev_ms":6,"test_count":660,"weak_tests":0},"status":"keep","description":"ip-info.test: FIX 2 tests (delete env.X to actually trigger ?? '' fallback)","timestamp":1777431389687,"segment":0,"confidence":126.33333333333333,"asi":{"hypothesis":"Fix 2 ip-info.test tests that were incorrectly using `ECHO_API_URL: ''` and `ECHO_API_KEY: ''` to try to trigger the `?? ''` fallback. The ?? operator only fires on null/undefined; empty-string is non-null so the fallback never executed and the falsy branch stayed uncovered. Switched to `delete env.X` to make the property genuinely undefined.","next_idea":"session at 225; ip-info.ts now 100% across all metrics","perf_note":"741 ms median, stddev 6 (excellent, very near best 725)","win":"ip-info.ts 81.81% → 100% branches AND 100% lines (previous fix didn't actually trigger ?? fallback). Real coverage gain confirmed by ip-info.ts no longer appearing in <100% branch report."}}
{"run":226,"commit":"5d38a68","metric":783,"metrics":{"fail_runs":0,"stddev_ms":7,"test_count":661,"weak_tests":0},"status":"keep","description":"hosts.test: ADD string-overload test (covers typeof-string branch in isAllowedHost)","timestamp":1777431442725,"segment":0,"confidence":126.33333333333333,"asi":{"hypothesis":"ADD hosts.test 'string-overload uses default ALLOWED_HOSTS env' — covers the `if (typeof envOrHost === 'string')` branch (line 31-32) of isAllowedHost. Existing tests all pass `(env, host)`; the single-arg string overload was unreached. Discovered by re-checking coverage report after #219: 'line 32' was the string-overload return, NOT the ?? fallback. The previously-named #219 fix actually covered a different branch (the 2-arg ?? fallback).","next_idea":"session at 226; hosts.ts now 100% across the board","perf_note":"783 ms median, stddev 7 (excellent)","win":"ADDED 1 test; hosts.ts 92.85% → 100% statements + branches"}}
{"run":227,"commit":"0bea3ec","metric":752,"metrics":{"fail_runs":0,"stddev_ms":11,"test_count":664,"weak_tests":0},"status":"keep","description":"projects.test: ADD 3 prompt-builder branch tests (plural hours, header (not set), webhook (not set))","timestamp":1777431567128,"segment":0,"confidence":126.33333333333333,"asi":{"hypothesis":"ADD 3 projects.test prompt-builder branch tests: (1) interval=12 covers `=== 1 ? '' : 's'` plural branch ('Every 12 hours'), (2) header_value=null with header_key set covers the `mask : '(not set)'` ternary false branch, (3) auto_backup_webhook=null covers the `?? '(not set)'` ?? branch. projects-prompt.ts branches 72.22% → ~94%+.","next_idea":"session at 227","perf_note":"752 ms median, stddev 11","win":"ADDED 3 tests; projects-prompt.ts branch coverage 72.22% → ~94%+"}}
{"run":228,"commit":"c3cb341","metric":780,"metrics":{"fail_runs":0,"stddev_ms":21,"test_count":665,"weak_tests":0},"status":"keep","description":"logs.test: ADD page/pageSize fallback test (covers parseInt-NaN || N branches)","timestamp":1777431631093,"segment":0,"confidence":126.33333333333333,"asi":{"hypothesis":"ADD logs.test 'non-numeric page falls back to 1 and pageSize <1 clamps up to 1' — covers lines 42-45 of handlers/logs.ts: the `parseInt(...) || N` fallback when input is non-numeric AND the Math.max(1,...) clamp on a negative parsed value.","next_idea":"session at 228; logs.ts now 100% across the board","perf_note":"780 ms median, stddev 21","win":"ADDED 1 test; logs.ts page/pageSize fallback branches now covered"}}
{"run":229,"commit":"3caad65","metric":770,"metrics":{"fail_runs":0,"stddev_ms":5,"test_count":666,"weak_tests":0},"status":"keep","description":"extractors.test: ADD TGZ streaming-gunzip bomb-defense test (covers MAX_DECOMPRESSED_SIZE overflow)","timestamp":1777431955060,"segment":0,"confidence":126.33333333333333,"asi":{"hypothesis":"ADD extractors.test 'TGZ: streaming gunzip rejects decompressed output exceeding MAX_DECOMPRESSED_SIZE' — covers line 72 of extractors.ts (the streamingGunzip incremental-byte-counter overflow check). Crafts a real tar with 50MB+1 of zeros (compresses to ~50KB), so the streaming gunzip aborts the decompression-bomb defense before the tar header is parsed. Catches a refactor that drops the streaming check.","next_idea":"session at 229; extractors.ts streaming-gunzip bomb-defense path now covered. Consider 2 more bomb-defense paths: ZIP declaredSize overflow (line 150-155), and gz JSON 50MB streaming overflow (line 165).","perf_note":"770 ms median, stddev 5 (excellent)","win":"ADDED 1 test exercising the previously-uncovered streamingGunzip overflow path; pins the exact bomb-defense user-facing message."}}
{"run":230,"commit":"b1a8639","metric":767,"metrics":{"fail_runs":0,"stddev_ms":7,"test_count":667,"weak_tests":0},"status":"keep","description":"extractors.test: ADD ZIP metadata-bomb defense test (overwrites declared uncompressedSize via CD-header byte surgery)","timestamp":1777432019298,"segment":0,"confidence":121.28,"asi":{"hypothesis":"ADD extractors.test 'ZIP: rejects entry whose declared uncompressedSize exceeds MAX_DECOMPRESSED_SIZE' — covers lines 152-156 (the ZIP metadata-bomb defense). Surgically rewrites the central-directory header's uncompressed-size field (offset +24 from CD signature 0x02014b50) so JSZip reports the lie. Catches a refactor that drops the metadata pre-check.","next_idea":"session at 230; ZIP metadata bomb defense covered. extractors.ts inching toward 80%+","perf_note":"767 ms median, stddev 7 (excellent)","win":"ADDED 1 test exercising previously-uncovered ZIP declaredSize check; pins the bomb-defense reason verbatim."}}
{"run":231,"commit":"12b4550","metric":766,"metrics":{"fail_runs":0,"stddev_ms":5,"test_count":668,"weak_tests":0},"status":"keep","description":"extractors.test: ADD tar-parse-error test (covers extract.on(error) handler with gunzipped non-tar bytes)","timestamp":1777432093599,"segment":0,"confidence":126.33333333333333,"asi":{"hypothesis":"ADD extractors.test 'TGZ: rejects when gunzip succeeds but tar parser errors' — covers line 389 of extractors.ts (the `extract.on('error')` handler) by feeding a valid gzip wrapping non-tar bytes. The streamingGunzip resolves cleanly; tar-stream then errors when parsing the bytes as a tar header. Pins the user-facing 'Failed to parse TAR archive — file may be corrupt' message verbatim.","next_idea":"session at 231; tar-extract error path covered. Lines 361-369 (per-entry streaming overflow) require tar-size-mismatch which is hard to construct cleanly. Lines 381 (stream.on('error')) similar. Defer.","perf_note":"766 ms median, stddev 5 (excellent)","win":"ADDED 1 test exercising tar-parse-error branch"}}
{"run":232,"commit":"172367d","metric":782,"metrics":{"fail_runs":0,"stddev_ms":8,"test_count":682,"weak_tests":0},"status":"keep","description":"d1-rest-adapter.test: NEW file, 14 tests covering retry matrix + UNIQUE-constraint detection + baseUrl/cred branches","timestamp":1777432172650,"segment":0,"confidence":121.28,"asi":{"hypothesis":"ADD d1-rest-adapter.test.ts NEW — 14 tests covering the legacy Next.js D1 REST adapter. Was at 40% statements with the entire retry+error matrix unexercised (transient 503/7429 retry, payload success=false retry+UNIQUE constraint detection, baseUrl override, exhausted retries, missing creds, default empty params). Stub fetch + no-op sleep makes retries synchronous.","next_idea":"session at 232; d1-rest-adapter.ts 40→~95% statements","perf_note":"782 ms median, stddev 8","win":"ADDED 14 tests; d1-rest-adapter.ts coverage 40.74%→~95% statements (also covers isRestD1Configured 3 branches)"}}
{"run":233,"commit":"1ea857d","metric":770,"metrics":{"fail_runs":0,"stddev_ms":8,"test_count":685,"weak_tests":0},"status":"keep","description":"webhook.test: ADD 3 non-Error-throw tests covering instanceof Error ?: fallback branches (lines 349, 384, 419)","timestamp":1777432254423,"segment":0,"confidence":116.61538461538461,"asi":{"hypothesis":"ADD 3 webhook.test non-Error throw tests covering the three `instanceof Error ? msg : 'fallback'` ternary false branches in webhook.ts (lines 349 R2 upload, 384 D1 insert, 419 outer catch). Each throws a non-Error value (string, plain object, number) to take the false branch. User response is unchanged — pins the no-info-leak contract: thrown payload never propagates, generic 'Internal server error' is returned regardless.","next_idea":"session at 233; webhook.ts branches 91.46→~95+%","perf_note":"770 ms median, stddev 8 (excellent)","win":"ADDED 3 tests; 3 instanceof-Error false branches now covered; no-info-leak contract pinned for non-Error throws"}}
{"run":234,"commit":"b94314c","metric":770,"metrics":{"fail_runs":0,"stddev_ms":8,"test_count":688,"weak_tests":0},"status":"keep","description":"webhook.test: ADD 3 branch tests (HEAD/GET non-Error catches + POST empty file.name/.type defaults)","timestamp":1777432380843,"segment":0,"confidence":116.61538461538461,"asi":{"hypothesis":"ADD 3 webhook.test branch tests: (1) HEAD non-Error throw — covers line 130 outer-catch instanceof-Error false branch; (2) GET non-Error throw — covers line 221 same; (3) POST file with empty .name + empty .type — covers lines 309 (`file.type || 'application/octet-stream'`) and 329 (`file.name || 'backup'`) falsy fallbacks. Pins the no-info-leak contract across HEAD/GET/POST and documents the sane-defaults behavior for browser-produced Files with empty metadata.","next_idea":"session at 234; webhook.ts now ~98%+ branches","perf_note":"770 ms median, stddev 8 (excellent)","win":"ADDED 3 tests; webhook.ts branches 95.12→~98%+; 4 previously-uncovered branches covered"}}
