{"run":29,"commit":"$(git r","metric":754,"metrics":{"fail_runs":0,"stddev_ms":9,"test_count":626,"weak_tests":0},"status":"discard","description":"try pool:forks across all workspaces","timestamp":1777416711505,"segment":0,"confidence":43.25714285714286,"asi":{"hypothesis":"switch all 3 workspaces from pool:threads to pool:forks (vitest 4 default; thought it might have lower start cost)","next_action_hint":"stay on pool:threads; threads share heap and start faster on macOS than fork()","rollback_reason":"754 vs 735 (within noise, but slight regression); forks pay process-creation cost on macOS"}}
{"run":30,"commit":"e8bf2f7","metric":731,"metrics":{"fail_runs":0,"stddev_ms":8,"test_count":626,"weak_tests":0},"status":"keep","description":"categories.test: assert exact 21-char nanoid format on createCategory id (was .length>0)","timestamp":1777416868457,"segment":0,"confidence":44.529411764705884,"asi":{"hypothesis":"tighten categories.test.ts id assertion: replace .length>0 with full nanoid format /^[A-Za-z0-9_-]{21}$/","next_idea":"look at additional .toBeGreaterThan-style fuzzy assertions across the suite; investigate whether stats handler tests can have more shape-pinning asserts","win":"perf within noise (735→731); one more 'fuzzy guard' tightened to a precise format check"}}
{"run":31,"commit":"$(git r","metric":756,"metrics":{"fail_runs":0,"stddev_ms":3,"test_count":626,"weak_tests":0},"status":"discard","description":"try web pool=vmThreads","timestamp":1777416958831,"segment":0,"confidence":45.878787878787875,"asi":{"hypothesis":"web pool=vmThreads (vm context isolation, may be faster than worker_threads)","next_action_hint":"stay on threads; vmThreads adds per-test vm.runInContext overhead and the saving doesn't materialize for happy-dom suites","rollback_reason":"756 vs 731: ~25ms regression due to vm context per-file overhead"}}
{"run":32,"commit":"cc057f9","metric":737,"metrics":{"fail_runs":0,"stddev_ms":8,"test_count":626,"weak_tests":0},"status":"keep","description":"api.test: fix vacuous-pass try/catch in ApiError text/json-parse branches (use rejects.toMatchObject)","timestamp":1777417050294,"segment":0,"confidence":51.32203389830509,"asi":{"hypothesis":"fix vacuous-pass bug in api.test.ts: 2 of 3 ApiError branch tests used try/catch without a 'should have thrown' guard, so if apiFetch ever started resolving instead of rejecting, the tests would silently pass. Replaced with await expect(...).rejects.toMatchObject(...)","next_idea":"audit similar try/catch-without-guard patterns; my scanner could be extended to flag tests that have try/catch with expect inside catch but no synchronous expect/throw before catch","win":"real bug-detection capability restored to 2 tests; perf within noise (731→737)"}}
{"run":33,"commit":"15b820c","metric":732,"metrics":{"fail_runs":0,"stddev_ms":10,"test_count":626,"weak_tests":0},"status":"keep","description":"scan-weak-tests: detect vacuous try/catch (no throw guard before catch with expects)","timestamp":1777417098765,"segment":0,"confidence":58.23076923076923,"asi":{"hypothesis":"extend scan-weak-tests to detect vacuousTryCatch (try-block with assertions inside catch but no thrown guard / await expect.rejects); confirms api.test.ts fixes covered them all (count = 0)","next_idea":"scanner heuristic could also flag tests where every assertion is `.toBe(<that same value passed in>)` (tautologies); tests that resolve to () => true","win":"scanner now defends against the specific bug class fixed in #32; perf within noise (737→732)"}}
{"run":34,"commit":"203502a","metric":731,"metrics":{"fail_runs":0,"stddev_ms":1,"test_count":626,"weak_tests":0},"status":"keep","description":"api setup: add loud-failing globalThis.fetch net guard (defensive, prevents accidental real fetch escapes)","timestamp":1777417254691,"segment":0,"confidence":59.372549019607845,"asi":{"hypothesis":"add a beforeEach net guard in api setup.ts that replaces globalThis.fetch with a loud-failing stub. Tests that need fetch (categories.test, ip-info.test, cron.test) already install their own; this catches accidental real fetch escapes before they hit prod-class flake territory.","next_idea":"extend net guard to worker workspace setup if it has fetch-using handlers; or look at performance once more with vitest-only optimization","stability_win":"stddev dropped to 1ms (effectively no variance); 5 runs all in 729–733ms"}}
{"run":35,"commit":"a28bae1","metric":732,"metrics":{"fail_runs":0,"stddev_ms":5,"test_count":626,"weak_tests":0},"status":"keep","description":"worker setup: add net guard + dns mock (mirrors api safety net)","timestamp":1777417388221,"segment":0,"confidence":60.56,"asi":{"hypothesis":"extend net guard + dns mock to worker workspace setup so worker handlers can't accidentally reach the network either; mirrors api setup safety net","next_idea":"look at api/handlers boilerplate consolidation; or pivot to bigger structural changes that remain safe","win":"perf within noise (731→732); stability hardened across both api+worker workspaces"}}
{"run":36,"commit":"fe72fb4","metric":752,"metrics":{"fail_runs":0,"stddev_ms":120,"test_count":626,"weak_tests":0},"status":"keep","description":"storage.test: use fake timers for 'defaults to current time' (replaces \\u00b11ms time-window assertion with exact equality)","timestamp":1777417481863,"segment":0,"confidence":63.083333333333336,"asi":{"hypothesis":"use vi.useFakeTimers + vi.setSystemTime to make storage 'defaults to current time' test fully deterministic instead of asserting Date.now() is within ±1ms tolerance","next_idea":"look at one more pattern — maybe restore.test.ts which had async URL signing that could be flaky","perf_note":"median 752 within noise of 731. raw run 1046 was a system-load spike (background work)."}}
{"run":37,"commit":"$(git r","metric":740,"metrics":{"fail_runs":0,"stddev_ms":5,"test_count":626,"weak_tests":0},"status":"discard","description":"re-bench: confirm fake-timers commit perf is stable","timestamp":1777417504718,"segment":0,"confidence":65.82608695652173,"asi":{"hypothesis":"verify previous fake-timers commit didn't add overhead (re-run for confirmation)","next_idea":"look at restore.test.ts and lib/url.ts edge cases for one more pass","stable_perf":"740 ms median, stddev 5 ms; ~10 ms over the all-time best of 731 (within noise)"}}
{"run":38,"commit":"$(git r","metric":725,"metrics":{"fail_runs":0,"stddev_ms":8,"test_count":626,"weak_tests":0},"status":"keep","description":"final bench: stable ~725ms median post-all commits","timestamp":1777417615563,"segment":0,"confidence":65.91304347826087,"asi":{"hypothesis":"final stability bench: confirm the suite holds at ~730ms median with low stddev after all 30+ commits","session_summary":"33 keeps + 5 discards + 2 checks_failed across 38 experiments. Reduced wall time 2241→725 ms (-67.6%), stddev 258→8 ms (-97%), weak_tests 23→0 (improved heuristic exposed and fixed all). 17 routes.test.ts OR-of-statuses tightened to deterministic assertions. Real-network deps eliminated (DNS stubbed, fetch net guard active). All coverage gates pass; test_count 648→626 (only meaningless surface tests removed).","stable_perf":"725 ms median, stddev 8 ms; raw 719-740 (±3%)"}}
{"run":39,"commit":"$(git r","metric":765,"metrics":{"fail_runs":0,"stddev_ms":14,"test_count":626,"weak_tests":0},"status":"discard","description":"web: net guard setup + auth-render beforeEach + scanner comment-strip","timestamp":1777417761688,"segment":0,"confidence":65.91304347826087,"asi":{"hypothesis":"add net guard + auth-render beforeAll→beforeEach refactor + scanner comment-stripping fix to apps/web","next_action_hint":"scanner fix and auth-render refactor are valuable; the net guard's overhead (~30ms) outweighs its safety value since no test currently leaks fetch. Re-apply only the scanner fix and auth-render refactor in next commit; revert the setup file.","rollback_reason":"consistent +30-40ms regression (725→750-765); web vitest beforeEach overhead from the setup file (runs in every test) is real"}}
{"run":40,"commit":"186eac5","metric":765,"metrics":{"fail_runs":0,"stddev_ms":20,"test_count":626,"weak_tests":0},"status":"keep","description":"scan-weak-tests: strip comments + string contents before regex (avoids false positives from English `test`/`it` in comments)","timestamp":1777417829088,"segment":0,"confidence":64.51063829787235,"asi":{"hypothesis":"re-apply only the scanner comment-stripping fix (skip the web setup file that caused the 30ms regression in #39); makes the scanner robust against false positives from English `test`/`it` in comments / strings","next_idea":"perf has stabilized around 730-765ms with sample-to-sample noise of ~20-50ms; further reductions need either prod-code changes (off-limits) or repo-root vitest install. Continue looking for quality wins.","perf_note":"765 ms median (noisy bench day); scanner change cannot affect the timed metric since it runs after the 5 timed bench iterations"}}
{"run":41,"commit":"$(git r","metric":771,"metrics":{"fail_runs":0,"stddev_ms":17,"test_count":626,"weak_tests":0},"status":"discard","description":"re-bench under load: 771 ms median (same artifact, noisier session)","timestamp":1777417930089,"segment":0,"confidence":63.166666666666664,"asi":{"hypothesis":"stability re-bench (no code changes)","perf_drift":"session-to-session noise floor seems higher this hour (medians 745-771 vs earlier 725); possibly system load. The all-time best 725 is reproducible on a clean system.","stable_floor_ish":"~750 ms median under modest concurrent load; ~725 on a quiet system"}}
{"run":42,"commit":"6c46fdc","metric":779,"metrics":{"fail_runs":0,"stddev_ms":6,"test_count":626,"weak_tests":0},"status":"keep","description":"routes.test: tighten 5 list-endpoint smoke tests with full toEqual body shape","timestamp":1777418079768,"segment":0,"confidence":61.87755102040816,"asi":{"hypothesis":"tighten 5 more route smoke tests with full toEqual body shape (logs/webhook+cron pagination payload, projects/categories empty arrays, backups paginated payload, stats/charts shape) so accidental shape drift is caught by L1","next_idea":"more route tests still only check status (~25 remaining); diminishing returns from each addition.","perf_note":"779 ms vs ~750 baseline (within session noise); keep for the meaningful shape verification gain"}}
{"run":43,"commit":"$(git r","metric":940,"metrics":{"fail_runs":0,"stddev_ms":91,"test_count":626,"weak_tests":0},"status":"discard","description":"remove worker setup file (test if it recovers perf)","timestamp":1777418203789,"segment":0,"confidence":60.64,"asi":{"hypothesis":"remove worker setup file to see if it recovers perf","rollback_reason":"high system load this run (median 940 ms vs ~770) made the signal unusable; revert and try later if needed","next_action_hint":"treat current bench as noise-bound; the worker setup file's overhead is sub-noise"}}
{"run":44,"commit":"dffd462","metric":757,"metrics":{"fail_runs":0,"stddev_ms":14,"test_count":626,"weak_tests":0},"status":"keep","description":"worker setup: drop unused node:dns mock; keep net guard only","timestamp":1777418333156,"segment":0,"confidence":59.450980392156865,"asi":{"hypothesis":"remove unnecessary node:dns mock from worker setup; only keep net guard","next_idea":"perf within noise; net guard alone is enough since worker tests don't traverse SSRF code paths (those live in api workspace where dns IS stubbed)","win":"smaller setup file = smaller per-test overhead; perf within noise (757 ms vs prior 770s)"}}
{"run":45,"commit":"$(git r","metric":999999,"metrics":{"stddev_ms":0,"weak_tests":0,"test_count":0,"fail_runs":5},"status":"crash","description":"try bun --bun for vitest (massive standalone speedup but incompatible with threads pool)","timestamp":1777418513216,"segment":0,"confidence":58.30769230769231,"asi":{"hypothesis":"switch root test script to `bun --bun` (forces bun runtime instead of node) — standalone bench showed web going 695→300ms (more than 2× speedup) when bun runs vitest","interesting_finding":"Bun --bun would be a HUGE perf win (~2x) if vitest could be made compatible. Try pool:forks-via-child_process under bun --bun in a future session.","next_action_hint":"DON'T USE — bun --bun + pool:threads is incompatible. Could try pool:forks under bun --bun (but earlier exp #29 showed forks slower under node). Maybe pool:vmThreads under bun --bun? Worth one test.","rollback_reason":"vitest threads pool requires worker_threads.stdout.pipe which Bun's worker compat doesn't fully implement. Error: 'this._thread.stdout.pipe is not a function'. All 11 web test files failed to start."}}
{"run":46,"commit":"$(git r","metric":999999,"metrics":{"fail_runs":5,"stddev_ms":0,"test_count":0,"weak_tests":0},"status":"crash","description":"try bun --bun + pool:forks (web ok but zod breaks under bun)","timestamp":1777418576941,"segment":0,"confidence":53.19298245614035,"asi":{"hypothesis":"bun --bun + pool:forks + 3 vitest configs forks could capture the bun runtime perf gain (~2x web)","next_action_hint":"DON'T USE — bun --bun is fundamentally incompatible with zod's `z.object` (undefined). Even with pool:forks, the api workspace's handlers break at module-load time. Bun --bun is a graveyard for this codebase.","rollback_reason":"bun --bun + zod = TypeError: undefined is not an object (z.object). Both api/handlers/categories and api/handlers/projects fail. Web speedup is moot if api+worker can't run."}}
{"run":47,"commit":"f2bffb8","metric":757,"metrics":{"fail_runs":0,"stddev_ms":11,"test_count":626,"weak_tests":0},"status":"keep","description":"categories+sanitize tests: tighten 5 toBeDefined() to format/equality checks","timestamp":1777418684276,"segment":0,"confidence":58.30769230769231,"asi":{"hypothesis":"tighten 5 toBeDefined() weak assertions in categories.test (createCategory id+timestamps) and sanitize.test (timestamps preserved verbatim from fixed makeProject fixture)","next_idea":"5 more toBeDefined left, all are guard-before-non-null-assertion idioms which are meaningful. Move on to webhook.test.ts (584 lines) for redundancy audit, or audit toContain assertions for shape-pinning opportunities.","win":"perf within noise (757); 5 fuzzy 'truthy' assertions tightened to format checks / exact equality. Now catches regressions where the impl returns empty string or differently shaped timestamps."}}
{"run":48,"commit":"b1a9991","metric":731,"metrics":{"fail_runs":0,"stddev_ms":11,"test_count":626,"weak_tests":0},"status":"keep","description":"storage.test: tighten 'auto-generates timestamp' to full-shape regex (was length+prefix+suffix triplet)","timestamp":1777418745184,"segment":0,"confidence":58.30769230769231,"asi":{"hypothesis":"tighten storage.test 'auto-generates timestamp' from length>baseline + startsWith/endsWith into a single regex matching the full backup-key shape (catches segment-order regressions, missing dashes, wrong precision, etc.)","next_idea":"audit toContain assertions in route tests for opportunities to use toEqual; or look for tests where the assertion only checks half the response shape","win":"perf 731 (back near all-time best 725, system quieter); 1 fuzzy length+prefix+suffix combo replaced with a precise regex"}}
{"run":49,"commit":"75af2a7","metric":746,"metrics":{"fail_runs":0,"stddev_ms":13,"test_count":626,"weak_tests":0},"status":"keep","description":"routes.test: tighten /db/init/marker from toHaveProperty to toEqual({marker:null})","timestamp":1777418782389,"segment":0,"confidence":58.30769230769231,"asi":{"hypothesis":"tighten /api/db/init/marker test from toHaveProperty('marker') to toEqual({marker: null}) — fakeD1 has no rows so the marker handler must resolve to a null marker","next_idea":"look for tests that mock all dependencies and never assert behaviour (pure mock-call counts); also restore.test.ts and backups.test.ts (627 lines) for redundancy","win":"perf within noise (746); 1 more shape-pinning win — toHaveProperty no longer hides the exact value"}}
{"run":50,"commit":"b839995","metric":743,"metrics":{"fail_runs":0,"stddev_ms":11,"test_count":626,"weak_tests":0},"status":"keep","description":"handler tests: add explicit r.kind assertion before union-narrowing if-blocks (11 spots in restore/backups/webhook/cron)","timestamp":1777418923684,"segment":0,"confidence":59.450980392156865,"asi":{"hypothesis":"Found a vacuous-pass bug class: 11 places across handler tests use `if (r.kind === 'json') { expect(...) }` to narrow the union type — but if the impl ever returns a different kind, ALL inner expects silently skip. Added `expect(r.kind).toBe('json'|'empty')` BEFORE each `if` so a kind regression fails loudly.","files_touched":"restore.test, backups.test, webhook.test (4 spots), cron.test (6 spots)","next_idea":"extend scan-weak-tests to detect this pattern (`if (X.kind === Y)` containing expects without a preceding kind assertion); also similar `if (r.body)` guards","win":"11 handler tests now catch HandlerResponse kind regressions (previously would silently pass); perf within noise (743 vs 746)"}}
{"run":51,"commit":"fdd9c0b","metric":763,"metrics":{"fail_runs":0,"stddev_ms":36,"test_count":626,"weak_tests":0},"status":"keep","description":"scan-weak-tests: detect vacuous union-narrow `if (X.kind === \\\"...\\\") { expect... }` without preceding kind guard","timestamp":1777418977718,"segment":0,"confidence":58.30769230769231,"asi":{"hypothesis":"extend scan-weak-tests with vacuousKindNarrow heuristic: detect `if (X.kind === \"...\") { expect(...) }` not preceded by `expect(X.kind)` guard. Verified by injecting a probe test file (correctly flagged the vacuous case, ignored the guarded one).","next_idea":"look at backups.test.ts (627 lines) for redundancy, audit toContain assertions, or look for tests that mock all dependencies and assert only mock-call counts","win":"scanner now defends against the 11-spot bug class fixed in #50; perf within noise (763, system noisy this run — stddev 36ms)"}}
{"run":52,"commit":"f39e7ad","metric":751,"metrics":{"fail_runs":0,"stddev_ms":3,"test_count":626,"weak_tests":0},"status":"keep","description":"backups.test: tighten restoreCommandHandler 3 toContain to exact toBe equality","timestamp":1777419022842,"segment":0,"confidence":60.64,"asi":{"hypothesis":"tighten backups.test 'restoreCommandHandler returns curl command' from 3 toContain checks to a single exact toBe equality — the curl string is fully deterministic given the test inputs","next_idea":"look at projects.test.ts prompt-builder toContain (4 checks across 2 tests) for similar tightening","win":"1 fuzzy assertion-trio replaced with exact equality (catches escape/ordering/format regressions); stddev down to 3ms, perf 751"}}
{"run":53,"commit":"11c83e6","metric":752,"metrics":{"fail_runs":0,"stddev_ms":3,"test_count":626,"weak_tests":0},"status":"keep","description":"projects.test: tighten 3 prompt-builder toContain assertions to specific markdown anchors","timestamp":1777419072684,"segment":0,"confidence":63.166666666666664,"asi":{"hypothesis":"tighten projects.test prompt-builder toContain assertions: 'Active' → '**(Active)**' (matches the Pull-row badge), 'X-K' → '**Auth header**: `X-K: ••••••••`' (full masked-header bullet), 'not yet enabled' → includes project name interpolation","next_idea":"audit url.test.ts edge cases / extractors.test.ts; or consolidate api/handlers test boilerplate","win":"3 prompt assertions now pin specific markdown anchors instead of bare substrings; 'Active' previously could have matched anywhere in the prompt (very common English word)"}}
{"run":54,"commit":"1a7d538","metric":753,"metrics":{"fail_runs":0,"stddev_ms":6,"test_count":626,"weak_tests":0},"status":"keep","description":"backups.test (web): tighten 3 generatePageNumbers tests to full toEqual on the deterministic array","timestamp":1777419130796,"segment":0,"confidence":64.51063829787235,"asi":{"hypothesis":"tighten apps/web/backups.test 3 generatePageNumbers tests from toContain('...')+head/tail anchors into a single full-array toEqual. Verified output is deterministic via standalone bun probe: (2,10)→[1,2,3,'...',10], (9,10)→[1,'...',8,9,10], (5,10)→[1,'...',4,5,6,'...',10].","next_idea":"auth-render.test.ts has toContain('boom') / toContain('secret-payload') — likely fine, used to verify SSR pass-through. Look at ctx.test.ts toContain on R2 presigned URL.","win":"3 partial-shape pagination tests merged into 3 full-shape equalities; catches anchor-position / ellipsis-count regressions"}}
{"run":55,"commit":"61aac63","metric":752,"metrics":{"fail_runs":0,"stddev_ms":3,"test_count":626,"weak_tests":0},"status":"keep","description":"ctx.test: tighten presignDownload R2 URL to full SigV4 regex (was 2 toContain)","timestamp":1777419177234,"segment":0,"confidence":65.91304347826087,"asi":{"hypothesis":"tighten ctx.test 'presignDownload S3 fallback' from 2 toContain (host substring + signature presence) to a single full-URL regex matching the entire SigV4 query string. Only date and signature are non-deterministic.","next_idea":"audit url.test.ts edge cases or look at categories.test.ts SQL toContain patterns","win":"1 fuzzy URL test now catches host/key/SigV4-param ordering or value drift; passes deterministically (752 ms median, stddev 3 ms)"}}
