{"run":56,"commit":"69980a5","metric":751,"metrics":{"fail_runs":0,"stddev_ms":14,"test_count":626,"weak_tests":0},"status":"keep","description":"r2-binding-adapter.test: tighten presignDownload spy from toHaveBeenCalledTimes to toHaveBeenCalledExactlyOnceWith","timestamp":1777419226703,"segment":0,"confidence":67.37777777777778,"asi":{"hypothesis":"tighten r2-binding-adapter test 'presignDownload delegates to options' from toHaveBeenCalledTimes(1) to toHaveBeenCalledExactlyOnceWith('file.bin', 120) — catches arg-swap regressions","next_idea":"audit url.test.ts edge cases or look for `.toHaveLength(N)` style fuzzy assertions","win":"1 fuzzy mock-call-count check tightened to exact arg verification (key+ttl); perf within noise (751)"}}
{"run":57,"commit":"b55c230","metric":745,"metrics":{"fail_runs":0,"stddev_ms":8,"test_count":626,"weak_tests":0},"status":"keep","description":"categories.test: tighten listCategories from toHaveLength+id checks to full toEqual(mockData)","timestamp":1777419264772,"segment":0,"confidence":68.9090909090909,"asi":{"hypothesis":"tighten categories.test 'returns all categories ordered by sort_order' from toHaveLength(2) + 2 id-checks to toEqual(mockData) — listCategories must pass D1 rows through verbatim","next_idea":"look at webhook-logs.test.ts:170 (result.items toHaveLength(1) only checks length not content); cron-logs.test.ts:103 same pattern; or look at /api/handlers/* for missed boundary tests","win":"1 partial-shape check tightened to full equality (catches body/color/sort_order pass-through regressions)"}}
{"run":58,"commit":"b9d00db","metric":760,"metrics":{"fail_runs":0,"stddev_ms":11,"test_count":626,"weak_tests":0},"status":"keep","description":"webhook-logs+cron-logs: tighten 2 paginated-list tests to full toEqual on mock fixture","timestamp":1777419311141,"segment":0,"confidence":72.19047619047619,"asi":{"hypothesis":"tighten 2 paginated-listing tests in webhook-logs.test and cron-logs.test from 5-piece partial-shape (length+id+name+pagination scalars) to a single full toEqual with the mock fixture passed verbatim. Catches column-rename/metadata-parse drift.","next_idea":"look at handlers/webhook.test.ts:284 (recent toHaveLength), or shift to perf scan: vitest projects mode at root (would need root vitest dep, declined earlier)","win":"2 tests now pin the entire response shape including the rehydrated row; perf within noise (760)"}}
{"run":59,"commit":"18a6f88","metric":788,"metrics":{"fail_runs":0,"stddev_ms":17,"test_count":626,"weak_tests":0},"status":"keep","description":"webhook.test: tighten recent_backups sanitization assertion to full toEqual on sanitized array","timestamp":1777419356509,"segment":0,"confidence":65.91304347826087,"asi":{"hypothesis":"tighten webhook.test '200 with backup list' from toHaveLength + 2 not.toHaveProperty + 1 id-equality to a single toEqual on the full sanitized recent[] array. Catches both leaks AND missing fields in one shot.","next_idea":"look at handlers/projects.test.ts sanitize-related tests; or audit `expect(...).not.toBe(undefined)` style","perf_note":"788 ms vs ~750 baseline (within session noise; system busier this run)","win":"1 partial-shape leak-checking test now positively pins the entire sanitized payload"}}
{"run":60,"commit":"dd9b669","metric":768,"metrics":{"fail_runs":0,"stddev_ms":22,"test_count":626,"weak_tests":0},"status":"keep","description":"projects.test: tighten listProjectsHandler sanitization to full literal-shape toEqual","timestamp":1777419449000,"segment":0,"confidence":68.9090909090909,"asi":{"hypothesis":"tighten projects.test 'returns 200 with sanitized list' from a single .toBeUndefined() leak check to a full literal-shape toEqual on the sanitized array. Rejected the tempting tautology of importing sanitizeProject() to compute the expected (the handler already calls it).","next_idea":"audit getProjectHandler / updateProjectHandler tests for similar partial-shape patterns; or look at extractors.test.ts edge cases (decompression bombs, nested paths)","win":"1 single-field leak assertion replaced with a full 11-field shape pin. Now also verifies pass-through fields and the auto_backup_headers_configured boolean. Caught a fixture-quirk along the way: makeProject() defaults auto_backup_* to non-null values."}}
{"run":61,"commit":"e4a7d3a","metric":800,"metrics":{"fail_runs":0,"stddev_ms":117,"test_count":626,"weak_tests":0},"status":"keep","description":"projects.test: positively assert webhook_token IS exposed in create response (one-time disclosure) and IS NOT in get response (sanitization gate)","timestamp":1777419519987,"segment":0,"confidence":65.91304347826087,"asi":{"discovery":"createProjectHandler intentionally returns the raw project (webhook_token included). Confirmed in handler impl: only listProjectsHandler / getProjectHandler / updateProjectHandler call sanitizeProject. The create path is the one-time token-disclosure boundary. Test now positively pins this contract.","hypothesis":"tighten 2 partial tests: createProjectHandler (now positively asserts webhook_token IS exposed at creation time, the one-time disclosure contract); getProjectHandler (now asserts webhook_token is NOT in the body, sanitization gate)","next_idea":"audit logs/handlers list endpoints; or look at restore.test.ts query-param token tests","perf_note":"high stddev (117ms) due to one outlier 1072ms (system spike); median 800 still in range","win":"+2 sanitization-gate tests now positively guard the create vs read boundary"}}
{"run":62,"commit":"9f61855","metric":755,"metrics":{"fail_runs":0,"stddev_ms":9,"test_count":626,"weak_tests":0},"status":"keep","description":"logs.test: tighten 'all filters parsed' from 6 partial checks to full toEqual on parsed filter object","timestamp":1777419583297,"segment":0,"confidence":68.9090909090909,"asi":{"hypothesis":"tighten logs.test '200 with all filters parsed' from 6 individual key checks to a single full toEqual on the captured filter object. Catches forwarded-key drift (projectId, method, errorCode were not asserted before).","next_idea":"audit handlers/cron.test.ts conditionals; or look at backups.test boundary tests","perf_note":"first bench had 3 outliers from system load (922 median); re-bench got 755 median, stddev 9 — the change adds no overhead","win":"1 6-key-by-key check converted to a single 9-field shape pin"}}
{"run":63,"commit":"d4f729e","metric":763,"metrics":{"fail_runs":0,"stddev_ms":3,"test_count":626,"weak_tests":0},"status":"keep","description":"logs.test (cron path): tighten '200 with valid status' to full toEqual on parsed filter","timestamp":1777419618355,"segment":0,"confidence":72.19047619047619,"asi":{"hypothesis":"tighten cron-logs handler '200 with valid status' from 1 status-only assertion to full toEqual on the parsed filter object (projectId, status, page, pageSize). Catches forwarded-key drift in the cron-logs path.","next_idea":"audit handlers/cron.test.ts trigger handlers; or look at backups handler test","win":"1 single-key check converted to a 4-field shape pin; perf within noise (763, stddev 3)"}}
{"run":64,"commit":"3a3bdc9","metric":777,"metrics":{"fail_runs":0,"stddev_ms":9,"test_count":626,"weak_tests":0},"status":"keep","description":"backups.test: tighten 3 listBackupsHandler status-only tests to positively assert forwarded args / clamp / fallback","timestamp":1777419673245,"segment":0,"confidence":72.19047619047619,"asi":{"hypothesis":"tighten 3 listBackupsHandler tests that only checked status=200: capture the args forwarded to listBackups() and pin them. (1) all-filters: full toEqual on the parsed-options object; (2) clamps pageSize>100: assert clamped value is 100, not just 200-status; (3) invalid sortBy: assert fallback resolves to 'created_at'. Each previously would have passed even if the impl silently dropped/swapped the parsed value.","next_idea":"audit upload/preview path tests in backups.test.ts for similar partial coverage; or look at projects.test handlers more","perf_note":"777 within session noise; bench is stable","win":"+3 listBackupsHandler tests now positively verify filter forwarding, clamping, and sort fallback (instead of just status code)"}}
{"run":65,"commit":"3adbf52","metric":757,"metrics":{"fail_runs":0,"stddev_ms":78,"test_count":626,"weak_tests":0},"status":"keep","description":"backups.test: tighten 2 upload-handler 201 tests to capture R2 uploads (count + content-type + key prefix)","timestamp":1777419748023,"segment":0,"confidence":75.8,"asi":{"hypothesis":"tighten 2 uploadBackupHandler 201-status-only tests to capture R2 uploads and verify (1) non-JSON files upload verbatim with preserved content-type and produce only 1 R2 object (no preview), (2) JSON files produce 2 R2 objects (gzipped backup + JSON preview).","next_idea":"audit deleteBackupHandler / restoreCommandHandler boundary tests; or look at handlers/cron.test for similar partials","perf_note":"757 median; 2 outliers from system load (914/913). Stable around 750.","typecheck_gotcha":"exactOptionalPropertyTypes: true requires `type: string | undefined` not `type?: string` when an undefined value is explicitly pushed. Caught by autoresearch.checks.sh — fixed before re-running.","win":"+2 upload-path tests now positively verify R2 side effects (count, content-type, key prefix) instead of just the response status"}}
{"run":66,"commit":"638e7e4","metric":761,"metrics":{"fail_runs":0,"stddev_ms":15,"test_count":626,"weak_tests":0},"status":"keep","description":"backups.test: tighten batchDeleteBackupsHandler '200 success' to capture R2 deletes + assert body shape","timestamp":1777419796605,"segment":0,"confidence":75.8,"asi":{"hypothesis":"tighten batchDeleteBackupsHandler '200 deletes successfully' from status-only to capturing R2 delete calls + asserting response body. Verifies (1) only the present jsonKey causes a delete (jsonKey:null shouldn't trigger r2.delete(null)), (2) all fileKeys are deleted, (3) response body is {success:true, deleted:2}.","next_idea":"audit downloadBackupHandler / restoreCommandHandler boundary tests; or shift to web tests that have similar partial coverage","win":"1 status-only test now positively verifies R2 cleanup ordering+filtering and the response body shape"}}
{"run":67,"commit":"f134af9","metric":802,"metrics":{"fail_runs":0,"stddev_ms":116,"test_count":626,"weak_tests":0},"status":"keep","description":"backups.test: tighten downloadBackupHandler '200' to assert ttl forwarding + body shape; fix adapter mock dropping ttl arg","timestamp":1777419874599,"segment":0,"confidence":75.8,"asi":{"discovery":"the helper-mock for r2.presignDownload was dropping the ttl arg silently. Caught only because my new test asserted both args. Fixed the adapter wiring to forward (key, ttl) so future tests can verify TTL contracts too.","hypothesis":"tighten downloadBackupHandler '200 with presigned url' to capture (file_key, ttl) passed to presignDownload AND assert the full response body shape (url, file_key, file_size, expires_in)","next_idea":"audit previewBackupHandler / restoreCommandHandler 200-status-only tests; or look for similar adapter-mock drops elsewhere","perf_note":"802 with high stddev (116ms) from system spikes (998+1011 outliers); raw 750-758 in quiet samples","win":"1 status-only test now positively pins TTL forwarding + response body shape; uncovered+fixed an adapter-mock arg drop"}}
{"run":68,"commit":"150c52c","metric":764,"metrics":{"fail_runs":0,"stddev_ms":8,"test_count":626,"weak_tests":0},"status":"keep","description":"restore.test: fix presignDownload mock dropping ttl arg + tighten '200 url' to assert TTL forwarding","timestamp":1777419936305,"segment":0,"confidence":75.8,"asi":{"hypothesis":"fix same arg-drop in restore.test.ts adapter mock (presignDownload was forwarding only key, dropping ttl). Tightened the '200 with presigned URL' test to assert both args (file_key, 900s TTL).","next_idea":"audit other adapter mocks for arg-drops; or move on to web tests","win":"1 more arg-drop fixed; 1 status+key-only test now positively pins TTL too"}}
{"run":69,"commit":"ddacdad","metric":811,"metrics":{"fail_runs":0,"stddev_ms":8,"test_count":626,"weak_tests":0},"status":"keep","description":"webhook.test: remove silent contentType default in adapter mock so tests can detect undefined pass-through","timestamp":1777420026984,"segment":0,"confidence":75.8,"asi":{"hypothesis":"remove the contentType ?? 'application/octet-stream' default substitution in webhook.test.ts adapter mock so tests can detect when the handler accidentally passes undefined contentType (fail-loud principle for adapter mocks)","next_idea":"session is now in stability mode (~750-810ms range, just system noise); could shift to maintainability work like consolidating handler-test boilerplate (in autoresearch.ideas.md)","perf_note":"811 vs prior ~760; system noise this run. Change is purely test-only with no extra work added to the test path.","win":"1 more silent-default-substitution removed; tests now positively assert contentType pass-through (mockUploadToR2 sees raw value)"}}
{"run":70,"commit":"2cbcbe6","metric":744,"metrics":{"fail_runs":0,"stddev_ms":18,"test_count":626,"weak_tests":0},"status":"keep","description":"backups.test: tighten previewBackupHandler '200' to full body toEqual including parsed JSON","timestamp":1777420076347,"segment":0,"confidence":75.8,"asi":{"hypothesis":"tighten previewBackupHandler '200 returns parsed content' from status-only to full body toEqual including parsed JSON content. Catches a regression that returns raw text instead of parsed JSON.","next_idea":"audit extractBackupHandler tests; or look at SQL toContain in categories.test for full-SQL tightening","win":"1 partial-coverage preview test now positively pins the full response shape including content parsing"}}
{"run":71,"commit":"db55ed8","metric":744,"metrics":{"fail_runs":0,"stddev_ms":6,"test_count":626,"weak_tests":0},"status":"keep","description":"backups.test: tighten 2 extractBackupHandler '200' tests to verify side effects + body shape","timestamp":1777420162547,"segment":0,"confidence":75.8,"asi":{"discovery":"extractBackupHandler reuses the previews/ key prefix for extracted JSON (not a separate 'extracted/' namespace). Caught by my regex assertion.","hypothesis":"tighten 2 extractBackupHandler tests: (1) '200 when json_key already set' — pin the no-op response shape (handler short-circuits without R2/DB writes); (2) '200 on successful extraction' — capture R2 upload + DB update side effects, pin response body including source_file and json_files_found from the extractor.","next_idea":"look at the upload-success test in webhook.test.ts (already partially tightened); or audit projects.test.ts updateProjectHandler tests","win":"+2 status-only tests now positively verify R2/DB side effects + response body shape; surfaced an interesting impl detail about key namespacing"}}
{"run":72,"commit":"3128b4c","metric":756,"metrics":{"fail_runs":0,"stddev_ms":9,"test_count":626,"weak_tests":0},"status":"keep","description":"projects.test: tighten 3 updateProjectHandler tests to capture+assert forwarded patch object","timestamp":1777420219328,"segment":0,"confidence":81.94594594594595,"asi":{"hypothesis":"tighten 3 updateProjectHandler tests by capturing the 2nd arg (the patch object) and asserting its exact shape: (1) clears allowed_ips: both null and '  ' must forward null; (2) normalizes valid CIDR forwards verbatim; (3) forwards auto_backup_* exactly with 5 keys.","next_idea":"audit cron.test 'success' / '200 fetch ok' tests; or look at db.test handler boundaries","win":"+3 status-only update tests now positively pin the patch shape; would catch regressions where the handler silently dropped/renamed any of the 5 forwarded fields"}}
{"run":73,"commit":"98dddb1","metric":813,"metrics":{"fail_runs":0,"stddev_ms":33,"test_count":626,"weak_tests":0},"status":"keep","description":"db.test: tighten dbInitHandler '200' to body shape ({ok:true, message})","timestamp":1777420262130,"segment":0,"confidence":75.8,"asi":{"hypothesis":"tighten dbInitHandler '200 on success' from status-only to body shape ({ok:true, message:'Schema initialized'})","next_idea":"audit the seed handler tests; or look at handlers/cron success-path tests","perf_note":"813 in noisy session (raw 779-867); change adds no test work","win":"1 status-only test now positively pins the success body shape"}}
{"run":74,"commit":"ada0b7a","metric":748,"metrics":{"fail_runs":0,"stddev_ms":5,"test_count":626,"weak_tests":0},"status":"keep","description":"db.test: fix 'seed verifies clean existing' fixture (name drift made it silently exercise 'reset' branch)","timestamp":1777420385942,"segment":0,"confidence":81.94594594594595,"asi":{"discovery":"the 'seed verifies clean existing' fixture had name='Backy E2E Test' but TEST_PROJECT.name is 'backy-test' — so the test silently exercised the 'reset' branch (not 'verified'), leaving the verified branch effectively uncovered. This is the second 'misnamed silent-pass' test caught this session (the first was the union-narrow if-blocks).","fix":"fixture now matches TEST_PROJECT field-for-field; assertion pins action='verified' + cleanedBackups=0","next_idea":"audit cron handler success-path tests; or audit handlers/stats.test","perf_note":"748 ms median, stddev 5 ms (back to quiet baseline)","win":"1 misnamed/wrongly-fixtured test fixed; 'verified' branch now actually covered + asserted in L1"}}
{"run":75,"commit":"5723cc0","metric":751,"metrics":{"fail_runs":0,"stddev_ms":7,"test_count":626,"weak_tests":0},"status":"keep","description":"cron.test: tighten 2 cronTriggerHandler tests to full summary toEqual (total+triggered+skipped+failed)","timestamp":1777420441178,"segment":0,"confidence":89.17647058823529,"asi":{"hypothesis":"tighten 2 cronTriggerHandler success-path tests from single-key checks (triggered:1 / failed:1) to full summary toEqual (total/triggered/skipped/failed). Catches double-counting bugs.","next_idea":"audit handlers/stats.test.ts; or look at the 4 remaining cron one-shot tests (cronTriggerOneHandler) for similar tightening","win":"+2 cron summary tests now positively pin all 4 counters; prevents double-counting / mislabeling regressions"}}
{"run":76,"commit":"f48e807","metric":743,"metrics":{"fail_runs":0,"stddev_ms":58,"test_count":626,"weak_tests":0},"status":"keep","description":"stats.test: tighten 3 handler tests to full toEqual body (snake\\u2192camel mapping + empty defaults + charts shape)","timestamp":1777420486175,"segment":0,"confidence":97.80645161290323,"asi":{"hypothesis":"tighten 3 stats handler tests: (1) totals-with-rows: pin entire snake→camel mapping; (2) totals-empty: pin all 3 zeroed defaults; (3) charts-200: pin the 3-empty-array shape (no extra fields).","next_idea":"audit handlers/cron one-shot tests (cronTriggerOneHandler) for full body shape; or look at categories.test SQL toContain","perf_note":"743 median; 1 outlier 889 (system spike). Stable.","win":"+3 status+single-key tests now positively pin the full response body shape; the snake_case→camelCase mapping is now end-to-end verified"}}
{"run":77,"commit":"d97c2b6","metric":770,"metrics":{"fail_runs":0,"stddev_ms":50,"test_count":626,"weak_tests":0},"status":"keep","description":"cron.test: tighten 2 cronTriggerOneHandler failure-path tests to assert the surfaced error message","timestamp":1777420538023,"segment":0,"confidence":108.28571428571429,"asi":{"hypothesis":"tighten 2 cronTriggerOneHandler failure-path tests from status='failed' check to full body toEqual including the surfaced error message ('Webhook URL is not allowed (must be HTTPS, public hostname)' for SSRF, 'Webhook URL blocked: private' for DNS)","next_idea":"audit categories.test SQL toContain patterns; or look at the cron success/fetch-fail tests which include durationMs (timing-dependent so need toMatchObject pattern)","perf_note":"770 with system noise; 1 outlier 894","win":"+2 cron failure-path tests now positively pin the user-facing error message instead of just the status string"}}
{"run":78,"commit":"fe789d3","metric":740,"metrics":{"fail_runs":0,"stddev_ms":3,"test_count":626,"weak_tests":0},"status":"keep","description":"cron.test: tighten 2 cronTriggerOneHandler tests (success+fetch-fail) to full body shape with responseCode + raw error body","timestamp":1777420587469,"segment":0,"confidence":97.80645161290323,"asi":{"discovery":"fireProjectWebhook surfaces the upstream response BODY (not status text) as `error` on non-2xx. So a 502 with body 'oops' yields error:'oops', not 'HTTP 502'. Pinning this exactly catches a regression that swaps body ↔ status text.","hypothesis":"tighten 2 cronTriggerOneHandler tests: (1) success: body is {status:'success', responseCode:200, durationMs:any-number}; (2) failed-fetch: body is {status:'failed', responseCode:502, error:'oops', durationMs:any-number}","next_idea":"audit categories.test SQL toContain for full SQL pinning; or look at remaining handlers","perf_note":"740 ms median, stddev 3 ms (quiet system; back near all-time best 725)","win":"+2 tests now positively pin responseCode + durationMs + raw error body — catches both response-shape drift AND error-source drift"}}
