{"run":104,"commit":"100f4a3","metric":751,"metrics":{"fail_runs":0,"stddev_ms":9,"test_count":626,"weak_tests":0},"status":"keep","description":"db.test: tighten 'seed creates' from partial body.action to full toEqual incl. projectId+webhookToken","timestamp":1777422000233,"segment":0,"confidence":126.33333333333333,"asi":{"hypothesis":"tighten db.test 'seed creates when not exists' from body.action partial check to full toEqual({action,projectId,webhookToken,cleanedBackups}). Pins TEST_PROJECT id+token are surfaced in the response (regression risk: a refactor that drops these fields from the created branch would have gone unnoticed).","next_idea":"audit db.test 'seed cleans orphaned backups' branch (currently checks status only?); or audit handlers/db.test schema-init paths","win":"1 partial-shape test now pins full created-branch envelope incl. TEST_PROJECT id+token surfacing"}}
{"run":105,"commit":"7149df5","metric":766,"metrics":{"fail_runs":0,"stddev_ms":9,"test_count":626,"weak_tests":0},"status":"keep","description":"db.test: tighten 4 handler tests (seed-500, seed-resets, getTestMarker x2) to full body shape","timestamp":1777422056456,"segment":0,"confidence":126.33333333333333,"asi":{"hypothesis":"tighten 4 db.test handler tests: seed-500 (full {error:'Error: db'} body — pins that the handler surfaces the raw error message via String(err) for debuggability), seed-resets-dirty (full reset-branch envelope incl. TEST_PROJECT id+token+cleanedBackups=0), getTestMarker present/null (toEqual full single-key body). Together these cover all remaining partial-shape branches in db handler.","next_idea":"audit handlers/backups.test - any remaining 4xx body partial checks; or ip-info.test","win":"+4 partial-body tests now full toEqual; db handler now has 100% body coverage"}}
{"run":106,"commit":"3f5445c","metric":756,"metrics":{"fail_runs":0,"stddev_ms":10,"test_count":626,"weak_tests":0},"status":"keep","description":"db.test: tighten getTestMarker error-path to full {marker:null,error} envelope","timestamp":1777422108843,"segment":0,"confidence":126.33333333333333,"asi":{"hypothesis":"tighten getTestMarker error-on-failure path: 2 single-key body.* assertions → single toEqual({marker:null,error:'table not found'}). Pins the {marker, error} envelope so a regression that drops 'marker:null' (and breaks E2E callers expecting it as a sentinel) would surface.","next_idea":"ctx.test.ts has 3 toContain checks on body.env array (debug endpoint, env keys list); pin to full toEqual sorted set","win":"1 partial-shape error-handler test pinned to full envelope"}}
{"run":107,"commit":"7a7e236","metric":745,"metrics":{"fail_runs":0,"stddev_ms":3,"test_count":626,"weak_tests":0},"status":"keep","description":"ctx.test: tighten env-key set-membership to full sorted toEqual (pins pickEnv allowlist contract)","timestamp":1777422160028,"segment":0,"confidence":126.33333333333333,"asi":{"hypothesis":"tighten ctx.test 'builds RuntimeContext from bindings' from 3 toContain(env-key) checks to a full toEqual(['CRON_SECRET','E2E_SKIP_AUTH','ECHO_API_URL']) of the keys exposed via ctx.env. pickEnv() in middleware/ctx.ts has a fixed allowlist; this catches a regression that forwards a binding (DB/R2) or drops a key.","next_idea":"audit webhook-logs.test.ts for partial SQL fragment toContain that could be replaced with toBe full SQL; or audit apps/web/auth-render.test.ts toLowerCase().toContain checks","perf_note":"745 ms median, stddev 3 ms (very stable)","win":"1 set-membership test now positively pins the full env-allowlist contract"}}
{"run":108,"commit":"fc3af6a","metric":748,"metrics":{"fail_runs":0,"stddev_ms":7,"test_count":626,"weak_tests":0},"status":"keep","description":"webhook-logs.test: tighten 4 partial param toContain checks to exact toEqual arrays","timestamp":1777422211815,"segment":0,"confidence":131.82608695652175,"asi":{"hypothesis":"tighten 4 webhook-logs.test param assertions: filterByProjectId/method/statusCode (toContain → toEqual single-element array; catches double-bind / extra silent params), and paginates (toContain 20 + toContain 40 → toEqual([20,40]) catches order-flip pageSize<>offset regression).","next_idea":"audit auth-render.test.ts toLowerCase().toContain checks for full text equality; or look at restore.test 500 error path","perf_note":"748 ms median, stddev 7","win":"+4 partial param tests now positively pin the exact bound-param list"}}
{"run":109,"commit":"b0706be","metric":765,"metrics":{"fail_runs":0,"stddev_ms":108,"test_count":626,"weak_tests":0},"status":"keep","description":"webhook-logs.test: tighten 5 more partial param toContain checks to exact toEqual arrays (pins binding order)","timestamp":1777422262394,"segment":0,"confidence":126.33333333333333,"asi":{"hypothesis":"tighten 5 more webhook-logs.test param assertions: 1-IP exclude, multi-IP exclude (order), combined exclude (order: projectId-then-clientIp), delete-projectId, delete-method, combine-multi-filters (order: projectId-then-method, success=false adds no param). Pins the param-binding ORDER which is critical for SQL placeholders.","next_idea":"audit auth-render.test toLowerCase().toContain checks for full text equality; or look at other partial-shape tests in apps/web","perf_note":"765 ms median; first 2 runs (1020/923) were system load (laptop spike); remainder 765/765/751 stable","win":"+5 partial param tests now pin exact array (catches param-order regressions in SQL binding)"}}
{"run":110,"commit":"0e955e0","metric":753,"metrics":{"fail_runs":0,"stddev_ms":7,"test_count":626,"weak_tests":0},"status":"keep","description":"auth-render.test: tighten 4 toLowerCase().toContain checks to case-sensitive exact UI text","timestamp":1777422310558,"segment":0,"confidence":131.82608695652175,"asi":{"hypothesis":"tighten 4 auth-render.test toLowerCase().toContain checks to case-sensitive exact 'Loading…'/'Redirecting to login…' visible-text matches (with the actual ellipsis char). Catches a regression that changes case (e.g. via CSS tw-uppercase removal regression) AND the old toLowerCase wrapper masked it.","next_idea":"audit lib-coverage.test.ts toLowerCase().toContain on RequireAuth integration; or look at handlers/projects.test for any remaining body partials","perf_note":"753 ms median, stddev 7","win":"+4 case-insensitive partial-text tests now pin exact UI string with ellipsis; regression-safe against case/character changes"}}
{"run":111,"commit":"e678238","metric":770,"metrics":{"fail_runs":0,"stddev_ms":35,"test_count":626,"weak_tests":0},"status":"keep","description":"lib-coverage.test: tighten reload-on-401 to case-sensitive 'Redirecting to login\\u2026' check","timestamp":1777422341021,"segment":0,"confidence":126.33333333333333,"asi":{"hypothesis":"tighten lib-coverage.test 'window.location.reload on ApiError(401)' assertion: toLowerCase().toContain('redirecting to login') → case-sensitive 'Redirecting to login…' (with ellipsis). Mirrors the auth-render.test contract; catches the same case/character regression.","next_idea":"audit handlers/cron.test 'noop when interval !ok' or other body branches; or look for any backups.test partials remaining","perf_note":"770 ms median; 1 outlier 846","win":"1 case-insensitive partial-text test now pins exact UI string; no toLowerCase masks remain in apps/web tests"}}
{"run":112,"commit":"d78d5de","metric":784,"metrics":{"fail_runs":0,"stddev_ms":15,"test_count":626,"weak_tests":0},"status":"keep","description":"cron-logs.test: tighten 7 partial param toContain checks to exact toEqual arrays (pins binding order)","timestamp":1777422405312,"segment":0,"confidence":126.33333333333333,"asi":{"hypothesis":"tighten 7 cron-logs.test param assertions: list-projectId/status/combined (toEqual single + ordered pair), list-paginates (toEqual([20,40])), delete-projectId/status/combined (toEqual single + ordered pair). Mirrors the webhook-logs.test contract — pins the exact param-binding ORDER which is critical for SQL placeholders.","next_idea":"audit extractors.test for partial reason toContain checks; or look at storage.test patterns","perf_note":"784 ms median, stddev 15","win":"+7 partial param tests now pin exact array; cron-logs DB layer fully covered for binding-order"}}
{"run":113,"commit":"abb46e3","metric":740,"metrics":{"fail_runs":0,"stddev_ms":15,"test_count":626,"weak_tests":0},"status":"keep","description":"extractors.test: tighten 7 partial reason toContain checks to full toBe exact user-facing copy","timestamp":1777422474494,"segment":0,"confidence":126.33333333333333,"asi":{"hypothesis":"tighten 7 extractors.test reason toContain checks to full toBe() exact user-facing reason copy. Includes templated `File \"data.json\" is not valid JSON` (catches a regression that drops the filename interpolation). Pins 6 distinct reason strings: already-JSON, Unsupported, No-JSON-files-ZIP, invalid-JSON-templated, parse-corrupt-ZIP, decompress-not-JSON-GZ, decompress-corrupt-GZ.","next_idea":"audit storage.test patterns / id.test (regex toMatch for ID format — may be reasonable as-is); or audit url.test ssrf reason strings","perf_note":"740 ms median, stddev 15 — close to all-time best 725","win":"+7 partial reason tests now pin exact user-facing copy + templated filename interpolation"}}
{"run":114,"commit":"78e40ed","metric":744,"metrics":{"fail_runs":0,"stddev_ms":6,"test_count":626,"weak_tests":0},"status":"keep","description":"extractors.test: tighten 3 TGZ tests to full toBe reason (incl. parse-order contract: gunzip-before-tar)","timestamp":1777422518872,"segment":0,"confidence":131.82608695652175,"asi":{"hypothesis":"tighten 3 extractors.test TGZ tests (no-JSON-files, invalid-JSON-templated, corrupt-decompress) to full toBe exact reason. Discovery: a 6-byte 'corrupt' input fails the gunzip step BEFORE the tar parse, so the surfaced error is 'Failed to decompress TGZ', not 'parse TAR' — documenting this contract in the test prevents future ambiguity.","next_idea":"audit url.test SSRF reason strings; or audit storage.test patterns","perf_note":"744 ms median, stddev 6 (very stable, near all-time best 725)","win":"+3 partial reason tests now pin exact user-facing copy + documents the gunzip-before-tar parse-order contract"}}
{"run":115,"commit":"3f57106","metric":748,"metrics":{"fail_runs":0,"stddev_ms":11,"test_count":626,"weak_tests":0},"status":"keep","description":"url.test: tighten 6 SSRF reason toContain to full toBe templated copy (incl. brackets-in-IPv6-host contract)","timestamp":1777422586760,"segment":0,"confidence":137.8181818181818,"asi":{"hypothesis":"tighten 6 url.test SSRF reason toContain checks to full toBe with templated reason. Discovery: the IPv6 reason templates use the BRACKETED hostname form ('[::1]', '[fe80::1]', '[fd00::1]') because the URL parser leaves brackets in the host string — a regression that strips brackets would break operator-facing logs. Pins: 'Resolved IP X', 'Invalid URL', 'DNS resolution failed for HOST', 'IPv6 address [X] is in a private range'.","next_idea":"look at apps/web/api.test for partial assertions; or other test files","perf_note":"748 ms median, stddev 11","win":"+6 partial-text reason tests now pin templated copy + documents brackets-in-host contract for IPv6"}}
{"run":116,"commit":"acab568","metric":753,"metrics":{"fail_runs":0,"stddev_ms":17,"test_count":626,"weak_tests":0},"status":"keep","description":"routes.test: tighten 2 toMatch(/i) regex assertions to full toEqual body envelopes","timestamp":1777422637143,"segment":0,"confidence":137.8181818181818,"asi":{"hypothesis":"tighten 2 routes.test toMatch(/i) regex assertions to full toEqual: ip-info-not-configured (503 with exact 'IP info service not configured' error) and db-init schema-init (200 with exact {ok:true, message:'Schema initialized'} envelope). Removes case-insensitive masks that hid copy-typo regressions.","next_idea":"audit categories.test sql toContain (line 49); or look at projects.test prompt-builder substring assertions","perf_note":"753 ms median, stddev 17","win":"+2 case-insensitive partial-text tests now pin exact full body envelope"}}
{"run":117,"commit":"3a4d31c","metric":745,"metrics":{"fail_runs":0,"stddev_ms":9,"test_count":626,"weak_tests":0},"status":"keep","description":"categories.test: tighten listCategories SQL toContain to full toBe + empty params toEqual","timestamp":1777422674905,"segment":0,"confidence":137.8181818181818,"asi":{"hypothesis":"tighten categories.test 'returns categories from db' SQL toContain to full toBe + params toEqual([]). Catches a regression that adds extra ORDER BY clauses, trailing whitespace drift, or appends silent params to the parameterless listCategories call.","next_idea":"audit ip-info handler tests for partial 502 path; or storage.test patterns","perf_note":"745 ms median, stddev 9 (very stable, near all-time best 725)","win":"+1 partial SQL test now pins exact statement; full DB-layer SQL coverage on categories listCategories"}}
{"run":118,"commit":"ab2e948","metric":749,"metrics":{"fail_runs":0,"stddev_ms":9,"test_count":626,"weak_tests":0},"status":"keep","description":"live.test: tighten sanitizes-ok from .not.toContain to exact toBe (positive sanitizer contract)","timestamp":1777422733971,"segment":0,"confidence":137.8181818181818,"asi":{"hypothesis":"tighten live.test 'sanitizes ok from error' from .not.toContain('ok') (negative assertion that passes for ANY non-ok message including 'foo' or '') to exact toBe('not *** message'). Pins the sanitizeMessage contract: word-boundaried 'ok'/'OK' → '***' (3 stars).","next_idea":"audit handlers/backups.test (large file ~700 lines, find any remaining smoke tests); or look at apps/web/projects.test","perf_note":"749 ms median, stddev 9","win":"1 negative-assertion (passes for empty/wrong messages) tightened to positive exact-string check; pins the sanitizer contract"}}
{"run":119,"commit":"98838b4","metric":739,"metrics":{"fail_runs":0,"stddev_ms":119,"test_count":626,"weak_tests":0},"status":"keep","description":"extractors.test: tighten 'not size-limited' to positive exact reason (keep negative 'no limit' contract)","timestamp":1777422776686,"segment":0,"confidence":137.8181818181818,"asi":{"hypothesis":"tighten extractors.test 'large content not size-limited' weak toContain('not valid JSON') to full positive toBe of the exact reason. Keeps the explicit .not.toContain('limit') as the test's stated purpose: ensure a 1MB non-JSON GZ surfaces the 'not valid JSON' branch (not the size-limit branch).","next_idea":"audit storage.test not.toContain (':' and '.') — reasonable contracts for the timestamp shape; or webhook-logs.test 'no NOT IN' negative checks","perf_note":"739 ms median; 1 outlier 1043 (system spike); near all-time best","win":"1 weak partial-text test now positively pinned to the exact branch reason"}}
{"run":120,"commit":"dbd6f79","metric":743,"metrics":{"fail_runs":0,"stddev_ms":5,"test_count":626,"weak_tests":0},"status":"keep","description":"storage.test: replace 2 .not.toContain with positive regex pinning dashes-only timestamp shape","timestamp":1777422812879,"segment":0,"confidence":137.8181818181818,"asi":{"hypothesis":"tighten storage.test 'returns a string without colons or dots' — 2 negative .not.toContain checks (which pass for ANY string with no colons/dots including empty string) replaced with a positive regex that pins the full dashes-only ISO-like shape /^YYYY-MM-DDTHH-MM-SS-mmmZ$/.","next_idea":"audit webhook-logs.test 'no NOT IN' negative checks (still potentially weak since they pass on bare WHERE w/ different filter); or look at remaining apps/web tests","perf_note":"743 ms median, stddev 5 (very stable, near all-time best 725)","win":"1 weak negative-assertion test now positive regex; pins the full dashes-only timestamp shape contract"}}
{"run":121,"commit":"fc25c8a","metric":742,"metrics":{"fail_runs":0,"stddev_ms":6,"test_count":626,"weak_tests":0},"status":"keep","description":"lib-coverage.test: tighten 2 pagination indexed-position checks to full toEqual arrays","timestamp":1777422863923,"segment":0,"confidence":137.8181818181818,"asi":{"hypothesis":"tighten lib-coverage 2 pagination tests: indexed-position partial checks (r[0]=1, r[1]!=='...', r[len-2]!=='...') replaced with full toEqual array. Discovery during fix: generatePageNumbers(2,10) returns [1,2,3,'...',10] and (9,10) returns [1,'...',8,9,10] — the previous tests' indexed-position checks (r[1]!=='...') silently allowed BOTH branches because they only asserted that the second position wasn't '...' but didn't pin which numbers were there.","next_idea":"audit other apps/web tests; look at backups.test for any remaining smoke tests","perf_note":"742 ms median, stddev 6 (very stable, near all-time best 725)","win":"+2 indexed-position partial pagination tests now pin full deterministic page array"}}
{"run":122,"commit":"dca3b58","metric":748,"metrics":{"fail_runs":0,"stddev_ms":20,"test_count":626,"weak_tests":0},"status":"keep","description":"charts.test: tighten 2 regex matches to exact toBe (formatBytes clamp + getChartColor negative-fallback)","timestamp":1777422927567,"segment":0,"confidence":137.8181818181818,"asi":{"hypothesis":"tighten 2 charts.test regex partial matches: formatBytes(1024^5).toMatch(/GB$/) → toBe('1048576 GB') (catches a regression that adds new units without bumping the clamp); getChartColor(-1).toMatch(/^hsl/) → toBe('hsl(var(--chart-1))') (documents the negative-index ?? fallback contract).","next_idea":"audit dashboard.test, layout.test, logs.test for partial regex assertions; or look at categories.test toMatch on id/timestamp","perf_note":"748 ms median, stddev 20","win":"+2 partial-regex test now pin exact value + document edge-case contracts (clamp, negative-index fallback)"}}
{"run":123,"commit":"709d51b","metric":763,"metrics":{"fail_runs":0,"stddev_ms":14,"test_count":626,"weak_tests":0},"status":"keep","description":"dashboard.test: tighten formatBytes clamp to exact toBe('1048576 TB')","timestamp":1777422966539,"segment":0,"confidence":137.8181818181818,"asi":{"hypothesis":"tighten dashboard.test 'formatBytes clamps very large values' from .toMatch(/TB$/) to exact toBe('1048576 TB'). Note: dashboard.test format.ts has 5 sizes (B/KB/MB/GB/TB) vs charts.test project-charts.tsx has 4 (no TB) — there are 2 separate formatBytes implementations that should be unified (deferred: prod-code change).","next_idea":"audit logs.test toMatch(/Aug|Jul|Sep/) and other tests for partial regex; or look at backups.test (apps/web)","perf_note":"763 ms median, stddev 14","win":"1 partial-regex tightened to exact value; documents the formatBytes double-implementation issue (charts vs format.ts)"}}
{"run":124,"commit":"0b3b89f","metric":758,"metrics":{"fail_runs":0,"stddev_ms":14,"test_count":626,"weak_tests":0},"status":"keep","description":"handlers/logs.test: tighten 5 status-only tests (deleteWebhook + listCron + 500s) to full body shape","timestamp":1777423054924,"segment":0,"confidence":137.8181818181818,"asi":{"hypothesis":"tighten 5 logs.test status-only handler tests: listWebhook 500 (Failed-to-list error), deleteWebhook 200/200/500 (success/empty-body/error), listCron-defaults 200 (full {items:[],total:0} envelope). Confirms handler passes the listCronLogs return verbatim (no re-wrapping).","next_idea":"audit r2-binding-adapter.test 2 not.toBeNull checks; or look at handlers/webhook.test for boolean-only assertions","perf_note":"758 ms median, stddev 14","win":"+5 status-only tests now pin response body shape; handlers/logs.ts now has full body coverage on all 6 endpoints"}}
{"run":125,"commit":"34c8b6e","metric":747,"metrics":{"fail_runs":0,"stddev_ms":14,"test_count":626,"weak_tests":0},"status":"keep","description":"handlers/logs.test: tighten 3 more cron handler tests (listCron-500, deleteCron-204+kind, deleteCron-500) to full body shape","timestamp":1777423095739,"segment":0,"confidence":137.8181818181818,"asi":{"hypothesis":"tighten 3 more logs.test cron handler tests: listCron 500 (Failed-to-list-cron-logs error body), deleteCron 204-with-filter (also pin r.kind='empty' so the kind:json was the regression), deleteCron 500 (Failed-to-delete-cron-logs body). handlers/logs.ts now has FULL body coverage on all 6 endpoints (4 success + 2 error branches × 4 handlers).","next_idea":"audit handlers/webhook.test for boolean-only assertions (createArg.isSingleJson); or look at remaining helper file partials","perf_note":"747 ms median, stddev 14","win":"+3 status-only tests now pin response body shape; handlers/logs.ts now 100% body-coverage"}}
{"run":126,"commit":"d9719c9","metric":744,"metrics":{"fail_runs":0,"stddev_ms":15,"test_count":626,"weak_tests":0},"status":"keep","description":"webhook.test: tighten createBackup arg from 4 boolean-only checks to single toMatchObject with 3 extra fields","timestamp":1777423145749,"segment":0,"confidence":144.38095238095238,"asi":{"hypothesis":"tighten webhook.test '201 success path with json+tag+env, uploads preview' — 4 single-property checks (environment, tag, senderIp, isSingleJson) consolidated into a single toMatchObject that ALSO asserts projectId, jsonExtracted=false, and fileType='json'. A regression that drops one of these fields from createBackup() would surface as one diff instead of being silently allowed.","next_idea":"audit handlers/cron.test for any remaining boolean-only check; or look at handlers/backups.test 4xx envelope shape","perf_note":"744 ms median, stddev 15 (very stable, near all-time best 725)","win":"1 4-prop boolean-only test consolidated to toMatchObject with 3 additional pinned fields (jsonExtracted, fileType, projectId)"}}
