{"run":127,"commit":"db5cfe5","metric":751,"metrics":{"fail_runs":0,"stddev_ms":82,"test_count":626,"weak_tests":0},"status":"keep","description":"backups.test: tighten 4 batchDelete + list-500 status-only tests to full body shape (2 distinct error msgs)","timestamp":1777423198272,"segment":0,"confidence":151.6,"asi":{"hypothesis":"tighten 4 backups.test status-only tests: list-500, batchDelete-400-empty/non-array/>50. Pins 2 distinct user-facing error messages: 'ids must be a non-empty array of strings' (validation branch) vs 'Maximum 50 backups can be deleted at once' (count-limit branch). Prevents a refactor from collapsing them into one generic message.","next_idea":"audit backups.test getBackupHandler 500 / deleteBackup 500 / 400 'when ids contain non-strings'; or look at upload/preview/extract 400-error paths","perf_note":"751 median, stddev 82 (1 outlier 954, system spike)","win":"+4 status-only tests now pin response body shape with 2 distinct validation-branch messages"}}
{"run":128,"commit":"0a7f790","metric":749,"metrics":{"fail_runs":0,"stddev_ms":8,"test_count":626,"weak_tests":0},"status":"keep","description":"backups.test: tighten 4 status-only tests (batchDelete + getBackup-500) incl. R2-non-fatal contract","timestamp":1777423242923,"segment":0,"confidence":151.6,"asi":{"hypothesis":"tighten 4 backups.test status-only tests: batchDelete-400-non-strings (validates conjunctive check hits same generic branch), batchDelete-R2-non-fatal (verify response includes deleted:1 even when R2 throws — i.e. R2 cleanup truly is non-fatal), batchDelete-500 (Failed-to-batch error), getBackup-500 (Failed-to-get error). Documents the conjunctive-validation contract and the non-fatal R2 cleanup contract.","next_idea":"audit deleteBackup R2-non-fatal branch and 500 path; or look at preview/extract/download 4xx-error envelopes","perf_note":"749 ms median, stddev 8 (very stable, near all-time best 725)","win":"+4 status-only tests now pin response body shape; documents R2-non-fatal contract positively (deleted:1 in body)"}}
{"run":129,"commit":"756cde8","metric":732,"metrics":{"fail_runs":0,"stddev_ms":5,"test_count":626,"weak_tests":0},"status":"keep","description":"backups.test: tighten 7 uploadBackup + deleteBackup status-only tests to body shape (incl. MAX_FILE_SIZE pin)","timestamp":1777423311686,"segment":0,"confidence":151.6,"asi":{"hypothesis":"tighten 6 uploadBackup status-only tests + deleteBackup-500: 400-missing-projectId, 404-project-missing (distinct 'Project not found' vs 'Backup not found'), 400-missing-file, 400-empty-file, 413-file-too-large (pins '50MB' limit string — catches a regression that bumps MAX_FILE_SIZE), deleteBackup-500. Documents the per-error user-facing message contract.","next_idea":"audit 400 invalid environment + remaining preview/extract/download 4xx tests; or look at upload 500 paths","perf_note":"732 ms median, stddev 5 (very stable, near all-time best 725)","win":"+7 status-only tests now pin response body shape; documents MAX_FILE_SIZE limit string + Project-vs-Backup not-found distinction"}}
{"run":130,"commit":"965177c","metric":749,"metrics":{"fail_runs":0,"stddev_ms":16,"test_count":626,"weak_tests":0},"status":"keep","description":"backups.test: tighten 400-invalid-env + 500-createBackup-throw (documents outer-catch generic-error contract)","timestamp":1777423385952,"segment":0,"confidence":151.6,"asi":{"hypothesis":"tighten 2 backups upload tests: 400-invalid-environment (pin Allowed:dev,prod,staging,test list), 500-createBackup-throw. Discovery: createBackup throws are caught by the OUTER try/catch which surfaces the generic 'Internal server error' (NOT 'Failed to upload backup' — that's the inner db-error path which doesn't re-throw). This documents a non-obvious error-routing contract that was hidden by status-only assertions.","next_idea":"audit downloadBackup, previewBackup, extractBackup 4xx 5xx paths; or close out remaining helper tests","perf_note":"749 ms median, stddev 16","win":"+2 status-only tests now pin body shape; documents the outer-catch generic-error contract for upload throws"}}
{"run":131,"commit":"a518e1c","metric":736,"metrics":{"fail_runs":0,"stddev_ms":4,"test_count":626,"weak_tests":0},"status":"keep","description":"backups.test: tighten 3 downloadBackup status-only tests (404 + 2x500 share generic error)","timestamp":1777423429480,"segment":0,"confidence":151.6,"asi":{"hypothesis":"tighten 3 downloadBackup tests: 404-missing (Backup not found), 500-db-error AND 500-presign-error (both surface the SAME 'Failed to generate download URL' — they share the outer try/catch). Documents that db-error and presign-error errors are indistinguishable to the caller (intentional: don't leak whether D1 or R2 was the failing dependency).","next_idea":"audit previewBackupHandler 4xx/5xx tests; or look at extractBackupHandler 4xx/5xx","perf_note":"736 ms median, stddev 4 (very stable, near all-time best 725)","win":"+3 status-only tests now pin response body shape; documents the dependency-opacity contract on download errors"}}
{"run":132,"commit":"bd034f7","metric":753,"metrics":{"fail_runs":0,"stddev_ms":14,"test_count":626,"weak_tests":0},"status":"keep","description":"backups.test: tighten 6 previewBackup status-only tests; discover dead null-body branch","timestamp":1777423505463,"segment":0,"confidence":151.6,"asi":{"hypothesis":"tighten 6 previewBackup status-only tests: 404-missing/no-json-key (incl. extractable:true flag the UI relies on), 413-too-large (hint to /download endpoint), 500-r2-body-missing/not-valid-JSON/download-error. KEY DISCOVERY: the {body:null} mock surfaces 'Failed to load preview' (outer catch) NOT 'Failed to download preview file from storage' — readR2Bytes() throws on null body BEFORE the explicit null-check is reached. This means line 313's null-check branch is unreachable in practice. Logged in autoresearch.ideas.md.","next_idea":"audit extractBackupHandler 4xx/5xx paths; or restoreCommandHandler","perf_note":"753 ms median, stddev 14","win":"+6 status-only tests now pin response body shape; surfaced a dead-code branch in previewBackupHandler"}}
{"run":133,"commit":"71daede","metric":779,"metrics":{"fail_runs":0,"stddev_ms":20,"test_count":626,"weak_tests":0},"status":"keep","description":"backups.test: tighten 5 extractBackup status-only tests (incl. templated size-limit reason)","timestamp":1777423565986,"segment":0,"confidence":151.6,"asi":{"hypothesis":"tighten 5 extractBackupHandler status-only tests: 404-missing, 400-already-single-JSON (distinct error from format-not-extractable), 400-not-extractable, 500-r2-body-missing (same dead-branch caveat as preview — outer catch returns 'Failed to extract...'), 400-contentLength-exceeds-limit (templated reason includes input size '60.0MB' AND limit '50MB' for operator diagnostics).","next_idea":"audit the remaining 400-extraction-fails + 500-extract-on-db-error tests; or look at restoreCommand handler tests","perf_note":"779 ms median, stddev 20 (system noise)","win":"+5 status-only tests now pin response body shape; documents the SAME dead-branch issue affects extractBackup as preview"}}
{"run":134,"commit":"2e904ee","metric":738,"metrics":{"fail_runs":0,"stddev_ms":8,"test_count":626,"weak_tests":0},"status":"keep","description":"backups.test: tighten 5 final status-only tests; handlers/backups.ts now 100% body-coverage","timestamp":1777423633757,"segment":0,"confidence":144.38095238095238,"asi":{"hypothesis":"tighten 5 backups status-only tests: extract-400-extraction-fails (extractor reason verbatim 'No JSON files found in the ZIP archive'), extract-500-db-error, restoreCommand-404-backup/project (distinct error msgs), restoreCommand-500-db. backups handler now has FULL body coverage on every 4xx/5xx error branch across all 11 endpoints.","next_idea":"audit categories.test SQL toBe coverage; or look at remaining handlers for partial coverage","perf_note":"738 ms median, stddev 8 (very stable, near all-time best 725)","win":"+5 status-only tests pinned; handlers/backups.ts now 100% body-coverage on errors"}}
{"run":135,"commit":"05fc95b","metric":736,"metrics":{"fail_runs":0,"stddev_ms":7,"test_count":626,"weak_tests":0},"status":"keep","description":"stats.test: tighten 2 500-status tests to distinct error messages (full body-coverage)","timestamp":1777423741063,"segment":0,"confidence":137.8181818181818,"asi":{"hypothesis":"tighten 2 stats handler 500 status-only tests: totals-500 (Failed-to-fetch-stats) and charts-500 (Failed-to-fetch-chart-data — distinct messages prevent collapse refactor). handlers/stats now 100% body-coverage.","next_idea":"audit handlers/cron.test for any remaining; or look at categories.test toBeUndefined cases","perf_note":"736 ms median, stddev 7 (very stable, near all-time best 725)","win":"+2 status-only tests pinned; handlers/stats now 100% body-coverage on errors"}}
{"run":136,"commit":"bf20610","metric":747,"metrics":{"fail_runs":0,"stddev_ms":9,"test_count":627,"weak_tests":0},"status":"keep","description":"sanitize.test: ADD positive allowlist test (catches future sensitive-field regressions)","timestamp":1777423823188,"segment":0,"confidence":144.38095238095238,"asi":{"hypothesis":"ADD positive allowlist contract test to sanitize.test (the 3 negative 'strips X' tests pass even if NEW sensitive fields are added to Project without sanitizing them; this catches regressions where Project gains a column like `internal_notes` and sanitizeProject silently exposes it). Test count 626→627. Pins exact 11-key allowlist via sorted toEqual.","next_idea":"audit hosts.test for similar additive opportunities; or look at file-type.test boolean tables for consolidation","perf_note":"747 ms median, stddev 9","win":"1 ADDITIVE positive-allowlist test now pins the exact 11 safe-fields contract; protects against future Project schema additions"}}
{"run":137,"commit":"43eb3c1","metric":740,"metrics":{"fail_runs":0,"stddev_ms":6,"test_count":627,"weak_tests":0},"status":"keep","description":"backups.test: tighten 2 .toBeDefined to toMatchObject (documents application/zip archive contract)","timestamp":1777423878632,"segment":0,"confidence":137.8181818181818,"asi":{"hypothesis":"tighten backups upload-zips-JSON-and-stores-preview test: 2 .toBeDefined() (which pass for any non-undefined value) replaced with toMatchObject pinning both upload content-types AND preview size=7. KEY DISCOVERY: backups are stored as 'application/zip' (NOT 'application/gzip' as I initially expected) — the impl uses ZIP format for the archive, not gzip. Documents this contract explicitly for the first time.","next_idea":"audit categories.test result.toBeDefined; or look at remaining toBeDefined patterns","perf_note":"740 ms median, stddev 6 (very stable, near all-time best 725)","win":"+2 weak .toBeDefined assertions tightened to toMatchObject; documents 'application/zip' archive contract"}}
{"run":138,"commit":"121b478","metric":744,"metrics":{"fail_runs":0,"stddev_ms":6,"test_count":627,"weak_tests":0},"status":"keep","description":"categories.test: consolidate 2 .toBeDefined into stronger toMatchObject (preserves test isolation)","timestamp":1777423928520,"segment":0,"confidence":137.8181818181818,"asi":{"hypothesis":"tighten 2 categories.test partial-update tests: 'updates only specified fields' (4 single-field checks + .toBeDefined consolidated to 1 toMatchObject + 1 updated_at-refreshed regex), 'updates all fields' (removed redundant .toBeDefined since the following .toEqual enforces stronger constraints).","next_idea":"audit web tests; or look at remaining low-hanging assertion patterns","perf_note":"744 ms median, stddev 6 (very stable, near all-time best 725)","win":"+1 weak .toBeDefined consolidated, +1 redundant assertion removed; both consolidated tests now have stronger contracts"}}
{"run":139,"commit":"4231910","metric":734,"metrics":{"fail_runs":0,"stddev_ms":7,"test_count":627,"weak_tests":0},"status":"keep","description":"webhook.test: tighten 4 status-only tests (HEAD-500 empty + GET 401/403/403 with no-info-leak msgs)","timestamp":1777423990414,"segment":0,"confidence":137.8181818181818,"asi":{"hypothesis":"tighten 4 webhook tests: webhookHead-500 (pin r.kind='empty' — documents that HEAD never returns a body for ANY status), webhookGet 401/403-token-invalid/403-IP-blocked (pin distinct user-facing error messages incl. no-info-leak contracts: same 'Invalid token or project mismatch' for unknown-token and token-mismatch; generic 'Forbidden' for CIDR mismatch).","next_idea":"audit webhookGet/webhookPost remaining 4xx/5xx; or look at webhookGet 200 envelope","perf_note":"734 ms median, stddev 7 (very stable, near all-time best 725)","win":"+4 status-only tests now pin response body shape; documents webhookHead-empty contract + 2 no-info-leak Get error contracts"}}
{"run":140,"commit":"2192adc","metric":745,"metrics":{"fail_runs":0,"stddev_ms":4,"test_count":627,"weak_tests":0},"status":"keep","description":"webhook.test: tighten 6 webhookGet+Post 4xx/5xx tests with no-info-leak error contracts","timestamp":1777424050390,"segment":0,"confidence":137.8181818181818,"asi":{"hypothesis":"tighten 6 webhookPost+webhookGet status-only tests: webhookGet-500 (Internal-server-error generic, no dependency leak), webhookPost-401/403-token/403-IP/400-missing-file/400-empty-file. Reuses 'no-info-leak' contracts established for restoreHandler/webhookGet (same 'Invalid token or project mismatch' / 'Forbidden' / 'Internal server error' messages).","next_idea":"audit webhookPost remaining 413/400-environment/500-error tests; or move to webhookPost 201 success paths' env-omitted assertions","perf_note":"745 ms median, stddev 4 (very stable, near all-time best 725)","win":"+6 status-only tests now pin response body shape; webhookPost handler now 100% body-coverage for 4xx errors"}}
{"run":141,"commit":"07f2b49","metric":751,"metrics":{"fail_runs":0,"stddev_ms":3,"test_count":627,"weak_tests":0},"status":"keep","description":"webhook.test: tighten 5 webhookPost 4xx/5xx tests; webhook handlers now 100% body-coverage on errors","timestamp":1777424130177,"segment":0,"confidence":137.8181818181818,"asi":{"hypothesis":"tighten 5 webhook tests: webhookPost-413 (pin '50MB' MAX_FILE_SIZE), 400-bad-env (pin Allowed:dev,prod,staging,test list), 500 r2/createBackup/getProject (all share 'Internal server error' — no dependency leak). webhookPost handler now 100% body-coverage on all error branches.","next_idea":"audit webhookPost remaining 201 success paths' body envelopes; or look at log handler tests","perf_note":"751 ms median, stddev 3 (very stable)","win":"+5 status-only tests now pin response body shape; webhook handlers (HEAD+GET+POST) now 100% body-coverage on errors"}}
{"run":142,"commit":"4ec13ee","metric":738,"metrics":{"fail_runs":0,"stddev_ms":3,"test_count":627,"weak_tests":0},"status":"keep","description":"routes.test: tighten /api/live to full envelope toMatchObject (catches snake-case drift)","timestamp":1777424200733,"segment":0,"confidence":137.8181818181818,"asi":{"hypothesis":"tighten routes.test 'GET /api/live both up' from 3 single-property checks to a full toMatchObject pinning the live-check envelope (status, uptime_s, version, timestamp regex, dependencies.d1/r2 with status+latency_ms snake_case). Catches snake→camel drift, dropped fields, and the absence-of-message-on-up contract.","next_idea":"audit other routes.test 200 envelopes; or look at handlers that haven't been fully tightened (like cron-logs handler tests)","perf_note":"738 ms median, stddev 3 (very stable, near all-time best 725)","win":"1 partial-property test consolidated into full envelope pin with snake_case + dependency-shape + timestamp-regex contracts"}}
{"run":143,"commit":"bd38554","metric":748,"metrics":{"fail_runs":0,"stddev_ms":12,"test_count":627,"weak_tests":0},"status":"keep","description":"access-auth.test: tighten 2 401 tests to pin no-info-leak Unauthorized contract","timestamp":1777424273855,"segment":0,"confidence":137.8181818181818,"asi":{"hypothesis":"tighten 2 access-auth.test 401 status-only tests (missing-jwt + invalid-jwt). Both surface generic 'Unauthorized' message — pins the no-info-leak contract: cannot distinguish missing vs invalid JWT from the response.","next_idea":"audit ctx.test SigV4 toMatch URL test; or look at handler-response.test or remaining patterns","perf_note":"748 ms median, stddev 12","win":"+2 status-only auth tests now pin no-info-leak Unauthorized contract"}}
{"run":144,"commit":"be5856f","metric":747,"metrics":{"fail_runs":0,"stddev_ms":5,"test_count":627,"weak_tests":0},"status":"keep","description":"access-auth.test: tighten 3 NOT-public tests to pin Access-misconfig body (proves matcher reached accessAuth)","timestamp":1777424332812,"segment":0,"confidence":144.38095238095238,"asi":{"hypothesis":"tighten 3 access-auth NOT-public tests to also pin the 'Cloudflare Access not configured' body. This positively confirms the request reached accessAuth (the public-path matcher did NOT short-circuit) — status-only could pass if some unrelated 500 was returned upstream. Documents the public-path matcher contracts: cron-trigger + project-id requires Access; webhook + sub-path requires Access; restore + sub-path requires Access.","next_idea":"audit handler-response.test or remaining patterns; or look at storage.test for any other partial assertions","perf_note":"747 ms median, stddev 5 (very stable, near all-time best 725)","win":"+3 status-only tests now positively pin the 'reached accessAuth' contract via response body"}}
{"run":145,"commit":"a25c76d","metric":744,"metrics":{"fail_runs":0,"stddev_ms":9,"test_count":627,"weak_tests":0},"status":"keep","description":"auth-render.test: consolidate 4 useMe-default property checks into single toMatchObject","timestamp":1777424374043,"segment":0,"confidence":151.6,"asi":{"hypothesis":"tighten auth-render.test useMe-default test: 4 single-property checks (email/authenticated/isLoading/mutate-function) consolidated into 1 toMatchObject. Catches missing fields (mutate dropped) or default-value drift (authenticated:undefined vs false).","next_idea":"audit layout.test getAvatarColor pattern; or look at categories.test toBeUndefined","perf_note":"744 ms median, stddev 9 (very stable, near all-time best 725)","win":"1 4-prop test consolidated; pins useMe() default-state shape contract"}}
{"run":146,"commit":"2e409ab","metric":739,"metrics":{"fail_runs":0,"stddev_ms":9,"test_count":627,"weak_tests":0},"status":"keep","description":"routes.test: tighten 7 status-only 401/400/404/500 tests to full body shape","timestamp":1777424445013,"segment":0,"confidence":144.38095238095238,"asi":{"hypothesis":"tighten 7 routes.test status-only tests: cron-trigger-401-wrong-secret, restore-401-no-bearer (full bearer-or-token msg), ip-info-400-missing-ip, me-500-no-Access, projects-404, categories-404, backups-404 — all to full body shape. Confirms cross-handler integration: 404 messages distinguish Project/Category/Backup, 401 messages match handler-level expectations.","next_idea":"audit remaining 45 status-only routes.test assertions; or look at ip handler tests","perf_note":"739 ms median, stddev 9 (very stable, near all-time best 725)","win":"+7 status-only routes integration tests now pin response body shape"}}
{"run":147,"commit":"fd227ff","metric":746,"metrics":{"fail_runs":0,"stddev_ms":7,"test_count":627,"weak_tests":0},"status":"keep","description":"routes.test: tighten 13 4xx tests; documents Hono missing-handler default-404 plain-text contract","timestamp":1777424526588,"segment":0,"confidence":151.6,"asi":{"hypothesis":"tighten 13 routes.test status-only tests: 3 DELETE-404 (project/category/backup), 2 POST-400 with Zod fieldErrors envelope (project/category), 2 PUT-404 missing-resource, 5 sub-resource 404 (token/prompt/download/preview/restore-command), 1 missing-handler 404 (GET extract = Hono default '404 Not Found' text body, NOT JSON — important contract since POST extract returns JSON). KEY DISCOVERY: GET on a route with only POST/PUT handlers in Hono returns plain-text '404 Not Found' from the framework default, not the handler's JSON {error}.","next_idea":"audit upload/extract POST 400/413 cases in routes.test; or look at remaining 500s","perf_note":"746 ms median, stddev 7 (very stable, near all-time best 725)","win":"+13 status-only tests now pin response body shape; documents Hono framework-default 404 contract vs handler-level JSON 404"}}
{"run":148,"commit":"744f182","metric":746,"metrics":{"fail_runs":0,"stddev_ms":6,"test_count":627,"weak_tests":0},"status":"keep","description":"routes.test: tighten 5 more status-only tests (204 No-Content body-empty contract)","timestamp":1777424569288,"segment":0,"confidence":151.6,"asi":{"hypothesis":"tighten 5 routes.test status-only tests: upload-400-empty-form (projectId-required), batchDelete-400-empty (validation msg), cron-trigger-projectId-404 (Project not found), logs-webhook-DELETE-200 (success:true), logs-cron-DELETE-204 (NO body — 204 No Content). Pin 204 means body is empty string.","next_idea":"audit remaining routes.test 200 success body envelopes; or look at remaining tests in other files","perf_note":"746 ms median, stddev 6 (very stable)","win":"+5 status-only tests now pin response body shape; documents 204-No-Content empty-body contract"}}
